,Date,Company,Article
17,2019-08-20,GAIL,"GAIL currently operates 11,000-km of pipeline network and markets two-thirds of all natural gas sold in the countryGAIL is looking to put up 400 CNG stations and give out a record 10 lakh piped natural gas (PNG) connections to household kitchens in the next 3-5 years

NEW DELHI :
State-owned gas utility GAIL India Ltd will invest over  ₹45,000 crore over the next five years to expand the National Gas Grid and city gas distribution network, its chairman Ashutosh Karnatak said on Tuesday.
""At present, your company is expanding the natural gas pipeline network by executing more than 5,700 kilometers of major projects,"" Karnatak said at the company's annual general meeting of shareholders here.
GAIL currently operates 11,000-km of pipeline network and markets two-thirds of all natural gas sold in the country.
""Investments worth over  ₹45,000 crore are envisaged in coming few years, across major cross country pipeline projects along Urja Ganga Project, Koch-Kootanad-Bangalore-Mangalore, Indradhanush North East Gas Grid and other crucial pipelines connecting supply and demand centres envisaged under the National Gas Grid,"" he said.
Later talking to reporters, he said the investment would span over the next five years.
Of this,  ₹32,000 crore would go into pipeline laying and another  ₹12,000 crore in city gas distribution (CGD) networks for retailing of CNG to automobiles and piped natural gas to household kitchens. Investments would also go into the expansion of petrochemical plants.
GAIL is looking to put up 400 CNG stations and give out a record 10 lakh piped natural gas (PNG) connections to household kitchens in the next 3-5 years.
It is rapidly building infrastructure to support the government push towards a gas-based economy by raising the share of natural gas in the energy basket to 15 per cent by 2030 from current 6.2 per cent.
The company is building a 2,655-km gas pipeline from Jagdishpur in Uttar Pradesh to West Bengal and Odisha.
""Around 1,050 km of pipeline projects along Varanasi-Dobhi-Patna/Barauni, Auraiya-Phulpur and other last-mile connectivity were completed during the 2018-19 fiscal,"" he said at the AGM.
Jagdishpur-Haldia & Bokaro-Dhamra Natural Gas Pipeline (JHBDPL) project, also known as the 'Pradhan Mantri Urja Ganga' project, was inaugurated by Prime Minister Narendra Modi in July 2015.
The pipeline would be extended to Guwahati by laying an additional 750-km line. At Guwahati, it would interconnect with the upcoming 1,500-km 'Indradhanush' pipeline network conceived to operate in northeast by the public sector oil and gas majors.
""Your company has recently been authorised by (regulator) PNGRB to lay the 600 km Srikakulam-Angul natural gas pipeline through the recently-concluded bidding process. This limb is expected to be an important segment of the National Gas Grid and enhance your company's coverage of natural gas markets along the eastern coast as well,"" he said.
Karnatak said the company's board has approved the utilisation of existing assets and premises of LPG plant at Usar in Maharasthra by converting it into 500,000 tonnes polypropylene complex at an investment of around  ₹8,800 crore.
""This is first of its kind project in India,"" he said, adding GAIL Board has also approved setting up of 60,000 tones polypropylene unit at the existing petrochemical facility at Pata in Uttar Pradesh.
Polypropylene is used in a variety of applications, including packaging of consumer products, plastic parts of various industries including the automotive industry, special devices like living hinges, and textiles.
This story has been published from a wire agency feed without modifications to the text. Only the headline has been changed."
18,2019-08-20,GAIL,"According to stock exchange data, BG Asia Pacific Holdings, a wholly owned subsidiary of Shell, sold 9.98 million shares through block deals at  ₹780 eachWhen Mahanagar Gas was listed on 1 July 2016, Shell acquired a 34% stake in the company through BG Asia Pacific

MUMBAI :
Shell India, the local arm of Royal Dutch Shell Plc, on Tuesday sold its 10% stake in the city gas distribution business of Mumbai-based Mahanagar Gas Ltd (MGL) for  ₹770 crore.
According to stock exchange data, BG Asia Pacific Holdings, a wholly owned subsidiary of Shell, sold 9.98 million shares through block deals at  ₹780 each.
In 2016, Shell took over BG Group Plc and, subsequently, acquired its assets worldwide.
On 4 March 2019, Mint had reported about Shell’s plan to exit MGL.
When Mahanagar Gas was listed on 1 July 2016, Shell acquired a 34% stake in the company through BG Asia Pacific.
Last year, it offloaded 24% of its shareholding in two tranches—8.5% in April and 14% in August—in the open market through bulk deals.
This reduced Shell’s holding to 10%. With the latest stake sale, the company has exited the city gas business in India.
Guidelines issued by capital markets regulator Securities and Exchange Board of India (Sebi) stipulate minimum promoters’ contribution shall be locked in for three years from the date of allotment in a public issue.
With the lock-in period ending, Shell has decided to sell its stake and focus on other businesses in India.
Other key shareholders of Mahanagar Gas are state-run gas utility GAIL (India) Ltd and the Maharashtra government.
Mahanagar Gas sells compressed natural gas (CNG) to retail outlets and piped natural gas (PNG) to households and industries in and around Mumbai.
Founded in 1995, Mahanagar Gas sells CNG to over 700,000 retail outlets and piped natural gas to over 1.17 million households.
The company runs more than 240 CNG retail outlets and plans to add 20 CNG stations each over the next two years."
16,2019-09-04,GAIL,"Seeking to boost bilateral trade from its current $11 billion, the two countries announced deals in sectors including energy, defence and shippingIndia, the world's third-biggest oil consumer and importer, aims to raise the proportion of gas in its energy mix to 15%

VLADIVOSTOK :
India and Russia are targeting $30 billion of annual trade by 2025, India's foreign secretary said on Wednesday as a string of energy deals deepened economic ties between the nations.
Seeking to boost bilateral trade from its current $11 billion, the two countries announced deals in sectors including energy, defence and shipping after a meeting between Russian President Vladimir Putin and Indian Prime Minister Narendra Modi at an economic forum in Vladivostok.
India, the world's third-biggest oil consumer and importer, aims to raise the proportion of gas in its energy mix to 15% in the next few years and diversify its energy supply to hedge against geopolitical risk.
""We have had a major breakthrough in the energy sector. This is a sector where we are looking to diversify our sources of supplies and we are increasingly finding it attractive to buy oil and gas from the Russian federation,"" India's foreign secretary, Vijay Gokhale, told a news conference.
Modi, who wants to cut India's oil imports by 10 percent by 2022, is steering efforts to buy foreign energy assets, taking advantage of low global oil prices and a slowdown in China's overseas acquisitions.
""We are looking at investing in additional oilfields in Russia ... we are also looking at sourcing LNG,"" Gokhale said.
Indian companies have stakes in Russian hydrocarbon assets including the Sakhalin-1, Imperial Energy, Vankor and Tass-Yuriakh fields, but it rarely imports oil from there because of logistical constraints and higher freight costs.
Gokhale said Putin wants safe, secure and cost-effective supply channels for India.
Among the deals announced on Wednesday, India's top gas importer Petronet LNG agreed to buy liquefied natural gas (LNG) from Novatek and invest in the Russian company's future projects. The two companies will also look at joint marketing of the gas as a motor fuel in India.
Indian coal producer Coal India, meanwhile, signed a deal to mine coking coal in Russia's Far East, while private company H-Energy is looking at buying LNG from Novatek on a long-term basis.
Besides investing in each other's future LNG projects, Novatek and H-Energy plan to set up a joint venture to market Russain LNG in India, Bangladesh and other markets.
Indian gas company GAIL (India), which has a 20-year contract to buy LNG from Gazprom, is looking to acquire a minority stake in the Arctic LNG-2 project led by Novatek, Vedomosti business daily reported on Wednesday, citing India's oil minister.
This story has been published from a wire agency feed without modifications to the text. Only the headline has been changed."
15,2019-09-08,GAIL,"ED said the Rolls Royce made a payment of over  ₹77 crore as commission to an agent to win contracts from PSUs HAL, ONCG and GAIL during 2007-11The CBI complaint alleged that the total business of HAL with Rolls Royce was around  ₹4,700 crore between 2000 to 2013

New Delhi: The ED has filed a criminal case to probe money laundering charges in an alleged corruption case involving London-based Rolls Royce that is said to have made a payment of over  ₹77 crore as commission to an agent to win contracts from PSUs HAL, ONCG and GAIL during 2007-11, officials said on Sunday.
The Enforcement Directorate (ED) has booked the case under provisions of the Prevention of Money Laundering Act (PMLA) after going through a Central Bureau of Investigation (CBI) FIR, which was registered in the case in July this year, they said. 
Rolls Royce and its Indian subsidiary, Singapore-based Ashok Patni and his company Aashmore Pvt Ltd, and Mumbai-based Turbotech Energy Services International Pvt Ltd, besides unidentified officials of public sector units (PSUs) Hindustan Aeronautics Limited (HAL), Oil and Natural Gas Corporation (ONGC) and GAIL were booked by the CBI for criminal conspiracy and bribery.
The CBI complaint alleged that the total business of HAL with Rolls Royce was around  ₹4,700 crore between 2000 to 2013.
It is alleged that Rolls Royce paid  ₹18 crore to Patni as ""commercial advisor"" in the 100 supply orders of Avon and Allison engines' spare parts to HAL between 2007-11, the bureau's FIR stated. The CBI action came after a five-year-long inquiry conducted by it. The inquiry was initiated on the basis of a complaint from the defence ministry that had received a letter about the engagement of Patni and his company by Rolls Royce. The ED will probe if these alleged corrupt practices led to the generation of slush funds which were laundered to create personal assets, the officials said. It will also investigate if the integrity pact was violated and kick backs were generated, they said. Rollys Royce, after registration of the CBI case, had said it will not tolerate business misconduct of any sort and it is committed to maintain high ethical standards.
""No one currently working for Rolls-Royce in India played any part in these energy deals. ""India is an important market for Rolls-Royce and the company has a valued workforce of skilled people in the country,"" a company spokesperson had said.
The CBI has charged that Patni was also engaged in direct contracts of Rolls Royce with ONGC and GAIL for the supply of spare parts.
Although contracts with ONGC and GAIL allowed services of an agent but it was mandatory to declare the name at the time of bidding, a condition violated by Rolls Royce, it said.
The company declared the name of its agent to the oil and gas sector behemoths in 2013, CBI alleged.
It is alleged that Roll Royce paid  ₹29.81 crore in 73 purchase orders from 2007 to 2011 for procurement of material and spare parts pertaining to the engines for ONGC, but the company declared it in 2013, it said. Roll Royce also paid one million British pounds with regard to 68 purchase orders from GAIL for spare parts from 2007 to 2010, it said.
The company entered in an arrangement with Turbotech Energy Services International Pvt Ltd and another company, Infinity, also owned by Patni, to which extra commission was paid, but not declared to GAIL, the CBI said.
The total commission paid by Rolls Royce comes to the tune of  ₹28.09 crore during the period 2007-10 for supplies to GAIL, it alleged.
There was an alleged conspiracy by Rolls Royce Plc and its subsidiary Rolls Royce India Pvt Ltd to misrepresent the facts before HAL regarding the engagement of the agent in order to win contracts with the public sector unit with ""deception"", it said.
The Indian Marine Gas Turbine unit of the HAL provides support in areas of inspection, spare parts, maintenance, equipment overhaul and assembly for industrial and marine gas turbines under licence from reputed manufactures.
The unit provides overhaul and repair of Avon and Allison engines for ONGC and GAIL for which spare parts are supplied by the energy division of Rolls Royce, it said.
The contract between Rolls Royce Power Engineering Plc and HAL was signed in June 2007, which was valid till December 2011, to provide maintenance, repair and overhaul services for units owned by the GAIL and ONGC under above licence from Rolls Royce.
""The purchase order condition specifically mentioned that Rolls Royce is not supposed to appoint any agent in India to promote this contract and no commission is payable to such agent,"" the CBI FIR has alleged.
It is alleged that Rolls Royce violated the condition of purchase order and integrity pact by engaging Patni and his company as commercial advisor from 2007 to 2011, and paid a commission ranging from 10 per cent to 11.3 per cent for supply of spare parts for the Avon and Allison engines.
The commission amount comes to the tune of  ₹18.32 crore during the period from 2007 to 2011 for the 100 purchase order, the CBI FIR alleged."
14,2019-09-08,GAIL,"Indian Oil, BPCL are also in the race for assets of the firm, which is divesting its pipeline businessGovt has been planning to split GAIL by hiving off its gas marketing and pipeline business

MUMBAI :
Canada’s Brookfield Asset Management and Singapore’s Temasek Holdings Ltd have joined the race to buy the gas pipeline assets of state-run Gail (India) Ltd, three people aware of the matter said.
A potential deal would be a vital win for Brookfield, which recently bought the gas pipeline assets of Reliance Industries Ltd. Gail owns more than two-thirds of India’s 12,000-km pipeline network.
Gail, which is in the process of divesting its pipeline business, has already received interest from state-run Indian Oil Corp. Ltd (IOCL) and Bharat Petroleum Corp. Ltd (BPCL) for the gas transmission assets.
“Prospective bidders have begun initial discussions with Gail and are expected to put a formal offer once a formal sale process begins post the demerger,"" said the first of the three persons cited above, all of whom requested anonymity.
Brookfield and Temasek declined to comment emails sent on Friday.
The government has been planning to split Gail by hiving off its gas marketing and pipeline business into a separate entity and selling a majority stake in it to strategic investors. The government holds 52.68% in Gail, which had a market capitalization of  ₹59,195.61 crore as on 6 September 2019.
Gail’s marketing business brought in more than three-fourths of its total revenue in the last fiscal.
Gail, India’s biggest natural gas marketing and trading firm, is also adding another 9,000km of pipelines. The company dominates India’s gas marketing landscape with a 59% share.
Gail did not reply to an email sent on Friday on details of the stake sale process.
An IOCL official said the company sees huge value in Gail’s transmission assets as it plans to expand its own gas distribution network. IOCL, the second-largest gas marketer in India after Gail, has lined up aggressive expansion plans for city gas distribution.
A BPCL official said Gail’s transmission network will give a fillip to its plans of expanding in the gas distribution business. Last fiscal, BPCL hived off its gas business into a separate wholly-owned unit so that the company can sharpen its focus by bringing all natural gas-related businesses into one fold.
Spokespersons at IOCL and BPCL did not respond to emails sent on Friday on whether they plan to bid for Gail’s pipeline assets.
A second person, an investment banker aware of the talks said, “The RIL-Brookfield pipeline deal has set a precedent for such asset monetization. Gail too has been exploring this option. They have held talks with several investors including, Brookfield and Singapore’s Temasek"".
This March, Brookfield’s India Infrastructure Trust, an InvIT, bought RIL’s loss-making entity East-West Pipeline for  ₹13,000 crore. The InvIT took 100% stake in Pipeline Infrastructure Pvt. Ltd that owns and operates the East-West Pipeline.
Though Gail has argued that its gas marketing and transmission businesses operate at arm’s length and hence splitting them is of little significance, the government, in order to meet part of its  ₹1.05 trillion target for raising revenue from disinvestments this fiscal, is keen on the bifurcation.
To achieve its disinvestment target last fiscal, the government has sold its entire 51.11% stake in refiner Hindustan Petroleum Corp. Ltd to state-run Oil and Natural Gas Corp. Ltd (ONGC) for  ₹36,915 crore.
Gail, which took shape in August 1984 after it was spun off from ONGC’s gas business, has multiple long-term contracts to import gas in its liquid form (LNG) from countries such as the US.
It is currently unclear if the strategic buyers would be given the responsibility of retaining these contracts. One option is to allow Gail to continue with the marketing business that would include all the sale contracts and the city gas retailing.
Since Gail has been maintaining separate accounts for its gas pipeline and marketing businesses, analysts said this makes it easier to split them into two entities. Gail’s networth rose to  ₹39,062 crore last fiscal from  ₹35,142 crore in the previous year."
13,2019-09-09,GAIL,"In other news, Norway’s state utility Statkraft has emerged on top in the race for Continuum Wind Energy, a wind energy platform owned by Morgan Stanley Infrastructure Partners

Mumbai: Mint brings you your dose of the top deals news, reported from newsrooms across the country.
Coffee Day group puts Sical Logistics on sale
Coffee Day Enterprises Ltd (CDEL), the company founded by late coffee tycoon V.G. Siddhartha, has put its Sical Logistics unit on the block as it seeks to pare debt, Mint reported citing three people directly aware of the matter. CDEL has hired ICICI Securities as adviser for the potential transaction, which could see the group holding company raise  ₹1,000-1,500 crore, as it plans to sell the entire promoter stake and assets of Sical Logistics. CDEL’s debt at the consolidated level is around  ₹4,400 crore. The sale of the Global Village Tech Park will bring down this debt to around  ₹2,000 crore, while a part of the proceeds from this sale will go to CDEL’s books towards working capital requirements. On 7 September, CDEL hired IDFC Securities to advice on strategic options including the sale of its holding in Coffee Day Global Ltd, the unit that owns India’s largest coffee chain, as well as on refinancing of the group’s debt.
Statkraft front-runner in race for Continuum Wind Energy
Norway’s state utility Statkraft has emerged on top in the race for Continuum Wind Energy, a wind energy platform owned by Morgan Stanley Infrastructure Partners, Mint reported citing two people aware of the development. In 2012, Morgan Stanley Infrastructure Partners, which manages more than $4 billion in assets globally, had invested $212 million in India-focused Continuum Wind, founded by Arvind Bansal and Vikash Saraf in 2009. Morgan Stanley currently has a majority stake in Continuum Wind. In May, Mint reported that Statkraft, along with strategic investors such as CLP India and global energy major Shell, were engaged in talks to acquire the wind energy platform. Continuum has more than 700MW of operational wind assets, making it one of the largest portfolios currently up for sale. The size of the portfolio makes it very attractive for strategic investors looking to expand their portfolio in India, the person cited above added.
Brookfield, Temasek eye GAIL’s gas pipeline assets
Canada’s Brookfield Asset Management and Singapore’s Temasek Holdings Ltd have joined the race to buy the gas pipeline assets of state-run Gail (India) Ltd, Mint reported citing three people aware of the matter. A potential deal would be a vital win for Brookfield, which recently bought the gas pipeline assets of Reliance Industries Ltd. Gail owns more than two-thirds of India’s 12,000-km pipeline network. Gail, which is in the process of divesting its pipeline business, has already received interest from state-run Indian Oil Corp. Ltd (IOCL) and Bharat Petroleum Corp. Ltd (BPCL) for the gas transmission assets. Prospective bidders have begun initial discussions with Gail and are expected to put a formal offer once a formal sale process begins post the demerger. The government has been planning to split Gail by hiving off its gas marketing and pipeline business into a separate entity and selling a majority stake in it to strategic investors. The government holds 52.68% in Gail, which had a market capitalization of  ₹59,195.61 crore as on 6 September 2019.
WestBridge may take majority control of Fogg-maker Vini Cosmetics
West-Bridge Capital is in discussions to take majority control of Vini Cosmetics, valuing the maker of Fogg deodorants at about  ₹6,500 crore, two years after it first backed the Ahmedabad-based consumer goods company, The Economic Times reported citing people familiar with the matter. The India-focussed fund plans to pick up an additional 30% stake in the company from early investor Sequoia Capital and the promoter group for around  ₹2,000 crore. If the transaction goes through, WestBridge will end up with a slightly over 50% shareholding in the Darshan Patel-founded company. Vini was valued at  ₹4,000 crore in 2017, when it last raised capital from WestBridge, which has invested in Star Health Insurance and diagnostics chain Dr Lal PathLabs, among others. The due diligence process is currently ongoing and is likely to conclude in a month’s time. While Sequoia is expected to make a complete exit, the promoters will shed about 15% of their holding. Patel co-founded Vini with younger brother Dipam Patel in 2009 and they together own more than 60% in the company. Sequoia and WestBridge hold 17% and 20%, respectively. WestBridge would want to build Vini into a large consumer goods company by acquiring brands and possibly tapping the public markets at a later stage.
Infiniti to raise  ₹750 crore from Tata Sons for Croma expansion
Infiniti Retail, the Tata Group’s smartphone and electronic retailing business which owns the Croma stores, plans to raise  ₹750 crore from the holding company — Tata Sons — over the next two years to part finance its expansion plans, The Economic Times reported citing its latest regulatory disclosures. For this, Infiniti Retail last month doubled its authorised share capital to  ₹2,000 crore from  ₹1,000 crore to issue fresh equity to the parent company. The company said in the flings it has plans for faster expansion across the nation with significant investment in ecommerce and digital solutions to enhance consumer experience and operating efficiency. Last fiscal, 22 new Croma stores were launched which the company said is the highest in any financial year aided by the introduction of goods and services tax and shift to digital payments taking the total number of outlets to 130."
