,Date,Company,Article
37,2019-02-06,GAIL,"GAIL had last year awarded a portion of the 2,655-km of the Pradhan Mantri Urja Ganga project to IL&FSThe company said the project consultant, Engineers India Ltd, was replaced by MECON for overseeing the project activities under this crucial stretch

NEW DELHI :
State-owned gas utility GAIL India Wednesday said it has terminated a  ₹270-crore pipe laying contract it had awarded to financially-troubled IL&FS and replaced it with another contractor.
The contract was terminated ""due to poor project progress driven on account of acute financial crisis,"" GAIL said in a statement here.
GAIL had last year awarded a portion of the 2,655-km of the Pradhan Mantri Urja Ganga project to IL&FS.
The project, costing  ₹12,940 crore, originates from Jagdishpur in Uttar Pradesh to Haldia in West Bengal, with branch lines to Bokaro in Jharkhand and Dhamra in Odisha.
IL&FS Engineering and Construction Company, a unit of the troubled IL&FS group, had won two contracts last year to lay 160 km in the Dobhi-Durgapur stretch and 100 km in the Bokaro-Angul stretch of the project.
Other contractors have the mandate for the remainder of two stretches, which are together about 850 km long. The 260-km pipeline contract to IL&FS was worth about  ₹270 crore.
""The Bokaro-Durgapur section (124 km) is now re-tendered and awarded to three different contractors to expedite construction efforts for hooking up supply network to the fertilizer, city gas distribution and other industrial consumers,"" GAIL said.
The company said the project consultant, Engineers India Ltd, was replaced by MECON for overseeing the project activities under this crucial stretch.
Phase one of the project involving laying the pipeline to Dobhi, Patna, and Barauni in Bihar, will be completed this month. The pipeline will be also extended from Barauni to Guwahati in Assam, orders for which have also been placed.
As per the earlier plan, the project was targeted at meeting the energy requirements of 40 districts and 2,600 villages covering five eastern states -- Uttar Pradesh, Bihar, Jharkhand, Odisha, and West Bengal -- by 2020. The project was launched in October 2016 and is also known as Jagdishpur-Haldia/Bokaro-Dhamra Pipeline (JHBDPL).
""In a swift move to safeguard project schedule of the Pradhan Mantri Urja Ganga natural gas pipeline to eastern states, GAIL as the owner and operator of the prestigious project under execution has offloaded the pipe laying contract from IL&FS due to poor project progress driven on account of acute financial crisis,"" the statement said.
Post commencing supplies at Varanasi, the final leg of Phase-I (Phulpur-Patna section of about 585 km) of the 2,660 km pipeline project is now closer to readiness and natural gas supply to Bihar's capital Patna is expected to commence during the second fortnight of this month, GAIL said.
GAIL Chairman and Managing Director B C Tripathi re-affirmed the company's commitment to ensuring completion of Pradhan Mantri Urja Ganga project.
""Accordingly, Phase two of this project beyond Dobhi (Gaya) towards Durgapur-Haldia and Bokaro-Ranchi-Angul-Dhamra (1,900 Km) is slated for progressive completion by December 2020 whereas the 750 km pipeline from Barauni to Guwahati is expected to be operational by December 2021,"" it said.
The 750-km pipeline up to Guwahati will cost  ₹3,700-4,000 crore.
The project will usher in industrial development in the eastern part of India by supplying environment-friendly natural gas to fertiliser and power plants, refineries, steel plants, and other industries.
It will also provide clean energy to households and transportation in the cities en route the pipeline. The city gas network activities in Varanasi, Bhubaneswar, and Cuttack have already commenced. P"
36,2019-02-15,GAIL,"The sale is part of the government divestment target of  ₹80,000 crore set for this fiscalThe one-day Additional Offering Period (AOP) managed by ICICI Prudential AMC launched on 14 February saw a subscription of over 14 times

The additional offering of Bharat-22 Exchange Traded Fund (ETF) which will help the government to inch close to its divestment target in fiscal year 2019 has received applications aggregating worth  ₹50,000 crore. The one-day Additional Offering Period (AOP) managed by ICICI Prudential AMC launched on 14 February saw a subscription of over 14 times, said an official statement.
“The offering attracted an aggregated subscription amount of approximately  ₹50,000 crore from all categories of investors. The total number of applications received stands at approximately 1.25 lakhs,"" said a statement issued by ICICI Prudential AMC.
The sale is part of the government divestment target of  ₹80,000 crore set for this fiscal. The government has so far raised  ₹22,900 crore through the Bharat-22 ETF. While  ₹14,500 crore was raised in November 2017, another  ₹8,400 crore was raised in June 2018.
The central public sector enterprises (CPSEs) that are part of the ETF include ONGC, IOC, SBI, BPCL, Coal India and Nalco.
Other constituents include Bharat Electronics, Engineers India, NBCC, NTPC, NHPC, SJVNL, GAIL, PGCIL and NLC India. Only three public sector banks — SBI, Indian Bank and Bank of Baroda — figure in the Bharat-22 index.
Also, the government’s strategic holding in Axis Bank, ITC and L&T, held through Specified Undertaking of Unit Trust of India (SUUTI), has been put in the ETF basket.
This would be the second ETF offering by the government in the current fiscal which ends in March. In November last year, the government had raised  ₹17,300 crore through a follow-on offer of another exchange traded fund — CPSE ETF, which comprises shares of 11 public sector enterprises. This was the biggest-ever fund raising from an ETF domestically."
35,2019-03-04,GAIL,"Domestic market for commercial drones is likely to overtake the military market by 2021, as per BIS ResearchThe drone space in India is on the verge of a major turnaround as a result of the green flag by the Directorate General of Civil Aviation 

Very soon Zomato will be delivering food at your doorstep using drones. The Gurugram-based company is building a hub-to-hub delivery network, which will use multi-rotor drones that can pick up a payload of under 5kg.
“We believe drones are an inevitable part of the future. Food delivery via drones will help reduce the last mile delivery leg and make the process more convenient and cost-effective,"" said Vikram Singh Meena, associate vice president, technology, Zomato, and founder of TechEagle.
Zomato is just a case in point. The drone space in India is on the verge of a major turnaround as a result of the green flag by the Directorate General of Civil Aviation (DGCA) in December 2018, and the yet to be released drone policy 2.0, which is expected to pave the way for wider application of drones in India. The domestic market for commercial drones will have a market value of $885.7 million, according to market intelligence firm BIS Research. With clarity on regulations, Indian companies are increasingly turning to drone-based solutions.
According to reports, Tata Steel is working with Skylark Drones, a Bangalore-based data analytics startup, to deploy drones at their Noamundi iron ore mines in Jharkhand, for compliance reporting and monitoring volumetric production. Skylark is also working with a major bauxite company, which is using their drone-based monitoring solution to ensure all equipment and manpower is being deployed at mines, according to plan, and is safe.
According to Skylark, it helped the company identify illegal mining during off season. Chennai-based DeTect Technologies has developed its own positioning system that works like an internal GPS of sorts, allowing its drones to monitor structures like a boiler inside a plant, autonomously. DeTect is working with Hindustan Petroleum, Indian Oil and GAIL.
“The amount of inspection done over several days can be heavily optimized and completed in a few hours with the use of drones and the analysis of that,"" says Daniel Raj David, CEO and co-founder, DeTect. Under the new policy, drones will need permission via the Digital Sky platform before they can take off. The new regulations, despite being somewhat more stringent than in other countries, have been received well by drone companies in India.
Mughilan Thiru Ramasamy, CEO Skylark Drones feels this is just the beginning of a new era and in the next two to three years more such use cases will come up, where drones will be deployed by enterprises for monitoring far-off sites and infrastructure that are not easily accessible such as a reservoir or a cell tower."
34,2019-03-29,GAIL,"GAIL shall be the project developer and BHEL shall act as an engineering, procurement, construction and project management contractorBHEL shall also provide operation and maintenance services during the initial period upon becoming successful bidder

New Delhi: State-owned gas utility GAIL India Ltd Friday said it has signed an agreement with Bharat Heavy Electricals Ltd (BHEL) for cooperation in the development of solar power projects.
""GAIL shall be the project developer and BHEL shall act as an engineering, procurement, construction and project management contractor,"" the company said in a statement.
BHEL shall also provide operation and maintenance services during the initial period upon becoming successful bidder.
""This development will help both the companies to leverage their competitive strengths to build a substantial portfolio in solar power projects.
""The memorandum of understanding (signed Friday) aims at building a closer strategic partnership between the two Maharatna PSUs for jointly pursuing commercial solar power projects through participation in tariff / Viability Gap Funding (VGF) based competitive bidding process,"" it said.
GAIL is India's biggest natural gas company with diversified interests across the value chain of trading, transmission, LPG production and transmission, LNG re-gasification, petrochemicals and city gas.
It owns and operates a network of around 11,400 kms of high-pressure trunk pipelines. It is working concurrently on multiple pipeline projects, aggregating over 5400 kms at an investment of about  ₹24,000 crore, to operate over 16,000 kms by 2021.
GAIL commands 75% market share in gas transmission and has a gas trading share of over 50% in India.
""GAIL is also expanding its presence in renewable energy like solar and wind. It has India's second-largest rooftop solar PV power plant at its petrochemical complex at Pata, Uttar Pradesh,"" the statement said.
BHEL is one of the few companies in the world, and only company in India, having the capability to manufacture the entire range of power plant equipment.
It has also been in the field of design, engineering, manufacturing, installation and commissioning of solar power plants over three decades and has a portfolio of more than 700 MW. 
This story has been published from a wire agency feed without modifications to the text."
33,2019-04-23,GAIL,"IL&FS has agreed to sell its 874 MW operational wind portfolio to GAIL (India) Ltd for  ₹4,800 croreGAIL’s offer of  ₹4,800 crore implies that the debt of  ₹3,700 crore on the wind power SPVs will be fully paid back

Mumbai: In its first asset sale since going bust last year, Infrastructure Leasing and Financial Services Ltd (IL&FS) on Monday said it has agreed to sell its 874 megawatts (MW) operational wind energy portfolio to state-run gas utility GAIL (India) Ltd for  ₹4,800 crore. The sale will close in three weeks, IL&FS said in a statement on Monday.
Significantly, GAIL’s offer of  ₹4,800 crore at 100% enterprise valuation implies that the accumulated debt of  ₹3,700 crore on the wind power special purpose vehicles (SPVs) will be fully repaid. The equity value on these assets will be  ₹1,100 crore.
The sale is subject to various approvals, including from a foreign equity partner in the assets and company law tribunals. Another 104 MW of under-construction wind power project, a solar power portfolio of 300MW and renewable energy EPC (engineering, procurement, construction) business will not be part of the deal. A spokesperson for IL&FS said a separate sale process is on for the residual renewable energy businesses.
The sale process kicked off in November with an invitation for expressions of interest (EoIs). Although the wind portfolio received 22 EoIs, there were fewer binding bids. At the end of the bidding process, GAIL emerged as the highest bidder for seven operating wind power plants with a total generation capacity of 874MW at an average tariff of  ₹5 per kilowatt hour (kWh).
The proposal was unanimously approved by the committee of creditors of IL&FS Wind Energy Ltd (IWEL), the majority owner of the SPVs. The company said it is engaged with ORIX Japan, which owns 49% stake in the wind portfolio and has a first right of refusal on the sale if valuation doesn’t match previously agreed expectations.
The sale proceeds, as and when realized by IWEL, will be held in a trust for distribution to the relevant stakeholders, as per the resolution framework filed with the National Company Law Appellate Tribunal, the statement said. A conclusion of the sale process will also be subject to approval of Justice (Retd.) D.K. Jain and the National Company Law Tribunal as per the resolution framework.
With debt of over  ₹1 trillion, the government replaced IL&FS’ previous management with an Uday Kotak-led board of directors to oversee the company’s resolution process. IL&FS is implementing various asset monetization programmes to recover what it can and repay debt. This includes the sale of its securities business, renewable energy assets, roads portfolio and EPC capabilities. So far, binding bids have been received for the securities business and the renewable energy arm, the management had said a few weeks ago, although no buyer has been named."
32,2019-05-16,GAIL,"Proposed JV marks a change in global energy architecture, with India at centre of Exxon’s growth plansExxonMobil’s focus on India shows the importance of the world’s third largest energy consumer

NEW DELHI :
ExxonMobil Corp., the world’s most valuable energy company, may shortly form a partnership with state-owned GAIL (India) Ltd to set up a green energy platform in India.
The US oil firm’s increasing focus on India is an acknowledgement of the growing importance of the world’s third largest energy consumer. The proposed joint venture (JV) to be announced shortly by the Irving, Texas-based firm also marks a change in the global energy architecture, with India at the centre of oil majors’ future growth plans.
The proposed ExxonMobil-GAIL tie-up comes against the backdrop of Infrastructure Leasing and Financial Services Ltd (IL&FS) agreeing to sell its 874 megawatts (MW) operational wind energy portfolio to the state-run gas utility for  ₹4,800 crore in its first asset sale since it started defaulting on payments last year.
“The discussions are on. We are likely to make an announcement in a fortnight or so,"" said B.C. Tripathi, chairman and managing director, GAIL (India) Ltd.
Oil giants are looking to diversify and invest in India’s green economy as the conventional hydrocarbon space undergoes technological disruption. For example, Malaysia’s state-run oil and gas company, Petroliam Nasional Bhd or Petronas has acquired Amplus Energy Solutions Pvt. Ltd, one of India’s largest rooftop solar power producers.
“Gail will tie up with ExxonMobil for a new energy venture. They will set up a joint venture for green energy sources. ExxonMobil will invest in it. The idea is to expand their clean energy presence,"" said a second person aware of the development, requesting anonymity.
With the biggest expense being the cost of capital in the green energy business, the financial heft of global oil majors will help India’s clean energy sector. India has been working on the largest clean energy programme and has an installed renewable energy capacity of 74.79GW. Of this, solar and wind power accounts for 25.21GW and 35.14GW, respectively. India’s energy demand is expected to grow at 4.2% over the next 25 years.
An ExxonMobil spokesperson said in an emailed response on 10 May, “We do not have any information for your story."" The spokesperson instead recommended Mint to contact the US-India Strategic Partnership Forum (ISPF) and the Federation of Indian Petroleum Industry (FIPI), an industry coalition.
A USISPF spokesperson in an emailed response said, “We’re reaching out to Exxon."" Queries emailed to FIPI on Saturday remained unanswered till press time.
Russia’s Rosneft, Norway’s Statoil ASA, France’s Total SA and Royal Dutch Shell Plc have also been exploring opportunities in India’s clean energy space. Some of these global majors already have a presence in the Indian conventional hydrocarbon space. While BP Plc partners Mukesh Ambani-controlled Reliance Industries Ltd in exploration and production ventures, the two are also partners in an equal joint venture for sourcing and marketing gas.
Also, Saudi Arabian Oil Co., the world’s largest oil producer, is looking to reportedly buy a stake in RIL’s refining and petrochemicals businesses and has partnered with Indian oil PSUs for setting up the world’s largest oil refinery and petrochemical complex in Maharashtra. Abu Dhabi National Oil Co. (Adnoc), the state-run oil firm of the United Arab Emirates, has also picked up a part of Saudi Aramco’s stake in the $44 billion refinery.
The Adani group also recently entered into an agreement with France’s Total to jointly develop multi-energy offerings in the Indian market which include fuel retail and liquefied natural gas."
31,2019-05-17,GAIL,"Romantic comedy De De Pyaar De barely works as an age-gap saga but is more effective as a comedyComedy drama, A Dog’s Journey, directed by Gail Mancuso is a corny canine caper

New Delhi: The storm unleashed by Avengers: Endgame has settled and Bollywood is slowly upping its game this summer.
Romantic comedy De De Pyaar De directed by Akiv Ali starring Ajay Devgn, Tabu and Rakul Preet Singh barely works as an age-gap saga but is more effective as a comedy about moving on and finding new soulmates, says Scroll. The writers heavily pad up material that is just about enough for an extended sitcom episode with songs (too many and all of them distractions), uneven comedy and needless melodrama. However, De De Pyaar De’s biggest achievement is that it might actually compel filmmakers to ask whether their leads are appropriately matched wrinkle for wrinkle rather than forcing chronological acrobatics on viewers.
The Indian Express calls the film a mixed bag. Starting off as a breezy older man-younger woman sex comedy, tipping over into an emotional family drama, and trying to sustain a progressive stance while keeping up the randy quotient: it’s both hit and miss.
For the Hollywood fans, American neo-noir action thriller John Wick: Chapter 3 – Parabellum starring Keanu Reeves directed by Chad Stahelski comes to India this week. Variety magazine calls it an action spectacular as dazzling as it is deadening. As masterfully executed as the action is, watching two-plus hours of mayhem without any palpable dramatic stakes, or nuance, or any emotion at all save bloodlust offers undeniably diminishing returns. There are only so many times you can see a bullet pass through a skull before it gets deadening, and then almost dull.
Comedy drama, A Dog’s Journey, directed by Gail Mancuso starring Josh Gad, Dennis Quaid, Marg Helgenberger, Betty Gilpin, Kathryn Prescott, and Henry Lau is a corny canine caper, says The Guardian. A sequel to A Dog’s Purpose (2017), on a second runout, that USP seems less eccentric, but equally some of the oddball novelty has worn off. Four credited screenwriters merely use that astral projection to usher another conveyor belt of pooches through much the same cornily conservative scenarios the studios churned out in Rin Tin Tin’s heyday.
The Hustle, a comedy directed by Chris Addison starring Anne Hathaway, Rebel Wilson, Alex Sharp, and Dean Norris flutters and sputters and all too quickly goes splat, says Rolling Stone. The setups are flat, the jokes don’t land and the actors don’t — or won’t — connect.
Telugu film ABCD – American Born Confused Desi starring Allu Sirish and Rukshar Dhillon directed by Sanjeev Reddy fails to entertain, says telugu360.com. While there is little to engage with in the first half, the second half is more story-oriented.
Several releases this week haven’t inspired any reviews yet. These include Tamil films Mr. Local, Monster, Jaikka Povadhu Yaaru and Natpuna Ennanu Theriyuma, Telugu romantic crime dramaRomantic Criminals and horror film Swayamvadha, Kannada thriller Ratnamanjarii, Kannada suspense thriller Kaarmoda Saridu, Malayalam comedy drama Kuttimama and Marathi dramaRampaat."
30,2019-05-19,GAIL,"Orix will exercise its right under the terms of an existing pact with IL&FSThe sale process to Orix is expected to be completed by June, subject to necessary approvals, according to the statement

Mumbai: Japan’s Orix Corp., which owns a 49% stake in each of the seven operating wind power plants of debt-laden IL&FS group, has expressed its intent to buy out the remaining 51% stake held by IL&FS Wind Energy Ltd (Iwel).
Orix will exercise its right under the terms of an existing pact with IL&FS (Infrastructure Leasing & Financial Services Ltd) wherein Orix can match the price offered by the highest bidder to buy Iwel’s stake in the wind power plants, IL&FS said in a release.
In April, state-run gas utility GAIL (India) Ltd had offered to pay  ₹4,800 crore (as enterprise valuation) for the 874-megawatt (MW) wind portfolio, subject to Orix agreeing to the sale. Orix, however, has now decided to buy out the remaining 51% stake by matching GAIL’s offer.
The sale process to Orix is expected to be completed by June, subject to necessary approvals, according to the statement.
The IL&FS group had amassed a debt of more than  ₹99,358 crore as of September 2018. Its default on debt payments caused a liquidity crisis in non-banking financial companies in India.
The completion of sale of special purpose vehicles to Orix will be subject to satisfaction of all compliances and approvals required under applicable laws—including approval of justice (retd.) D.K. Jain and the National Company Law Tribunal—in accordance with the proposed resolution framework, IL&FS said.
The sale proceeds, as and when realized by Iwel, shall be held in trust for distribution to the relevant stakeholders.
Another 104MW of under-construction wind power project, a solar power portfolio of 300MW and renewable energy EPC (engineering, procurement, construction) business will not be part of the deal. A spokesperson for IL&FS had said earlier that a separate sale process is on for the residual renewable energy businesses.
The government had in October 2018 replaced IL&FS’s previous management with an Uday Kotak-led board to oversee the company’s resolution process. IL&FS is implementing various asset monetization programmes to raise funds and repay debt.
The sale process for assets in areas such as education, funds, domestic roads, thermal power, water infrastructure, technology and key international assets is currently underway and binding financial bids are expected for these companies/businesses in stages by July 2019, the statement said."
29,2019-05-27,GAIL,"GAIL Q4: Margins on natural gas sales and transmission more than made up for the loss in the petrochemical business.The company also recommended the payment of final dividend of  ₹1.77 per share.

State gas utility GAIL India today reported a 20% rise in its March quarter net profit as margins on natural gas sales and transmission more than made up for the loss in the petrochemical business.
Net profit in January-March at  ₹1,222.23 crore, or  ₹4.98 per share, was 19.70% higher than  ₹1,020.92 crore, or  ₹4.53 a share, net profit in the same period of the previous fiscal year, the company said in a regulatory filing.
Revenue rose to  ₹18,763.87 crore in the fourth quarter of 2018-19 fiscal year when compared with  ₹15,430.69 crore net profit in the year-ago period.
The board of GAIL also approved a 1:1 bonus issue of one free share for every share held.
GAIL had a segment loss of  ₹20 crore in its petrochemical business. Also, pre-tax profit on LPG and liquid hydrocarbons business halved to  ₹416.15 crore.
This, however, was made good by higher margins on gas transmission and natural gas sales businesses. Pre-tax profit on gas transmission business rose 8.3 per cent to  ₹777.92 crore while that on natural gas marketing tripled to  ₹587.53 crore.
The company also recommended the payment of final dividend of  ₹1.77 per share."
