,Date,Company,Article
54,2018-05-31,GAIL,"GAIL (India)'s natural gas transmission volume in Q4 declined sequentially to 106 mscmd from 109 mscmd in the December quarter

GAIL (India) Ltd missed Street expectations in the March quarter (Q4), with its Ebitda (earnings before interest, tax, depreciation and amortization) of Rs1,695 crore falling short. This was primarily owing to disappointing numbers from the petrochemicals business and weaker performance of the gas trading segment. 
GAIL (India) Ltd missed Street expectations in the March quarter (Q4), with its Ebitda (earnings before interest, tax, depreciation and amortization) of Rs1,695 crore falling short. This was primarily owing to disappointing numbers from the petrochemicals business and weaker performance of the gas trading segment.
Sure, petrochemicals volumes increased year-on-year and sequentially as well. However, realizations were lower compared to last year’s March quarter and there were input costs pressures too. In fact, the gas trading business was also adversely affected due to higher input costs, leading to shrinking of margins.
The company’s natural gas transmission volume declined sequentially to 106 million standard cubic metres per day (mscmd) from 109 mscmd in the December quarter. Antique Stock Broking Ltd pointed out in a note to clients that volumes were negatively impacted by lower offtake from the power sector and a drop in domestic production (-3.5mscmd quarter-on-quarter), which got partially offset by higher liquefied natural gas (LNG) imports.
In comparison, liquefied petroleum gas and liquid hydrocarbons delivered a satisfactory performance.
Overall, pre-exceptional items and tax earnings declined 4.7% year-on-year to Rs1,577 crore. A sharp decline in other income also adversely affected net profit performance to that extent.
GAIL (India)’s shares fell 5% on 24 May in reaction to the numbers, although they have recovered since. Valuations seem inexpensive at about 14 times estimated earnings for this fiscal year.
What’s more, there are a few encouraging factors from a medium-term perspective. Higher crude oil prices are expected to offer some relief for the company’s US LNG contracts. Soft Henry Hub gas prices, higher Asian LNG prices and benign shipping costs imply, though, that these contracts are now profitable and remain so above $60 a barrel (Brent Crude prices), pointed out analysts from Jefferies India Pvt. Ltd in a report on 25 May.
“The revenue drivers for GAIL are on a growth trajectory with transmission/ trading volume set to stay firm over coming quarters,"" said Antique Stock Broking. Petrochemical earnings too should improve, as utilization improves at Pata-2 (petchem expansion in Uttar Pradesh).
Considering valuations aren’t demanding and outlook on many segments is sanguine, if investors are patient, the wait might just bear some good fruit."
53,2018-06-13,GAIL,"The second tranche includes Bharat-22 ETF stocks such as ONGC, Indian Oil, SBI, Coal India, Nalco and GAIL India

New Delhi: The finance ministry will launch the second tranche of Bharat-22 ETF on 19 June which will help the government raise up to Rs8,400 crore from the markets. The issue will open for anchor investors on 19 June and for other institutional and retail investors the next day. The exchange traded fund (ETF) follow-on offer will remain open till 22 June. The investors would get a 2.5% discount over the Bharat-22 price. 
New Delhi: The finance ministry will launch the second tranche of Bharat-22 ETF on 19 June which will help the government raise up to Rs8,400 crore from the markets. The issue will open for anchor investors on 19 June and for other institutional and retail investors the next day. The exchange traded fund (ETF) follow-on offer will remain open till 22 June. The investors would get a 2.5% discount over the Bharat-22 price.
“The government is aiming at mopping up  ₹ 6,000 crore, with a green-shoe option to retain another  ₹ 2,400 crore from the Bharat-22 ETF follow on offer to be launched on 19 June,"" a finance ministry official said.
The second part of Bharat-22 ETF would also help the government in meeting the minimum public holding norm in PSUs like Coal India Ltd.
The government had in November last year launched Bharat-22 ETF comprising shares of 22 companies, including public sector undertakings (PSUs), public sector banks, ITC Ltd, Axis Bank Ltd and Larsen and Toubro Ltd. The fund had garnered bids to the tune of Rs32,000 crore, although the government retained only Rs14,500 crore.
The state-owned companies or PSUs that are part of the new Bharat-22 ETF stock include Oil and Natural Gas Corp. Ltd (ONGC), Indian Oil Ltd, State Bank of India, Coal India and Nalco.
The other PSUs on the list are Bharat Electronics, Engineers India, NBCC, NTPC, NHPC, SJVNL, GAIL, PGCIL and NLC India. Only three public sector banks—SBI, Indian Bank and Bank of Baroda—figure in the Bharat-22 index.
The government plans to raise Rs80,000 crore in the current fiscal from disinvestment, lower than over Rs1 trillion raised last year.
On Tuesday, the government had through a public notice said it will divest 12% stake in railway consultancy firm RITES through an IPO which will be launched on 20 June.
Prior to the launch of Bharat-22 ETF which has a diversified portfolio, the government had floated the CPSE ETF comprising stocks of 10 blue-chip stocks—ONGC, Coal India, Indian Oil, GAIL (India) Ltd, Oil India, PFC, Bharat Electronics, REC, Engineers India and Container Corporation of India.
Through the CPSE ETF, the government had raised  ₹ 11,500 crore in three tranches— ₹ 3,000 crore from the first tranche in March 2014,  ₹ 6,000 crore from the second tranche in January 2017 and  ₹ 2,500 crore from the third tranche in March 2017."
52,2018-07-05,GAIL,"Gujarat Gas Ltd (GGL), India's largest city gas distribution (CGD) company, is looking to pick up the entire 50% stake of GAIL Gas in Vadodara Gas Ltd (VGL) for 200-250 crore

Ahmedabad: Gujarat Gas Ltd (GGL), India’s largest city gas distribution (CGD) company, is looking to pick up the entire 50% stake of GAIL Gas in Vadodara Gas Ltd (VGL), according to three senior government officials close to the development. The deal size is expected to be about  ₹ 200-250 crore for an enterprise valuation of about  ₹ 500 crore of VGL, two of these officials said. 
Ahmedabad: Gujarat Gas Ltd (GGL), India’s largest city gas distribution (CGD) company, is looking to pick up the entire 50% stake of GAIL Gas in Vadodara Gas Ltd (VGL), according to three senior government officials close to the development. The deal size is expected to be about  ₹ 200-250 crore for an enterprise valuation of about  ₹ 500 crore of VGL, two of these officials said.
GGL, controlled by Gujarat State Petronet Ltd (GSPL), was earlier looking to pick a minority stake in VGL from GAIL Gas. However, it has recently decided to pick up the entire stake of Gail Gas in the entity, the officials said.
GSPL is a subsidiary of Gujarat government owned-Gujarat State Petroleum Corp. Ltd (GSPC). A few months ago, Gujarat Gas roped in SBI Caps for a valuation of the entity, said a senior GSPC official on condition of anonymity.
“The matter is between GAIL Gas and Gujarat Gas and it is for them to take a final call in the matter,"" said Shailesh Naik, commercial director, VGL.
While GAIL Gas, a wholly owned subsidiary of GAIL (India) Ltd, has agreed to sell 50% stake to Gujarat Gas, a restrictive clause in the 50:50 JV agreement between GAIL Gas and local civic body Vadodara Mahanagar Seva Sadan (VMSS) does not allow either of them to sell more than 20% to Gujarat Gas.
As a result GAIL Gas has sought an amendment in the restrictive clauses of its shareholding agreement with VMSS. The matter is pending before a standing committee of VMSS which is to take a final call in the matter. The committee is headed by Vadodara mayor Jigeeshaben Sheth who was appointed to the post recently.
“The proposal that GAIL Gas wants to exit VGL by selling their stake to Gujarat Gas has come to us. They have requested for changing the restrictive clause to that effect. We are looking into the matter and within a month or so we will decide about it,"" Sheth said over the phone.
A senior executive of GAIL Gas and a Gujarat Gas spokesperson refused to comment on the matter.
Vadodara city has the oldest CGD network in the country that was set up by the local municipal corporation in 1972. In 2013, it formed a 50:50 joint venture company with Gail Gas called VGL as per the Petroleum and Natural Gas Regulatory Board (PNGRB) Act 2006, with an authorized share capital of Rs.215 crore. VGL had outlined a capital expenditure plan of Rs.200 crore in the first five years wherein it would take the number of household connections from 75,000 in 2013 to 180,000 in 2018, according to information available on GAIL Gas’ official website.
“However, VGL has only added about 30,000 households in this period. Vadodara is a pioneer of pipeline gas distribution for cooking but it is far behind other cities of Gujarat in the development of CGD network. If you look at Rajkot which is comparable to Vadodara in size and population, 70,000 new connections have been added since 2013. In the last ten years since Gujarat Gas started operations in Rajkot, there are about 196,000 household connections in the city,"" said one of the three senior state government officials quoted earlier."
51,2018-07-11,GAIL,"Adani Gas Ltd bid for 32 licenses, while its joint venture with IOC bid for 20 city gas licenses

New Delhi/Mumbai: Billionaire Gautam Adani’s gas retailing unit is among firms that submitted 400 bids for the 86 areas the Indian government offered in its latest auction for city-gas licenses. 
New Delhi/Mumbai: Billionaire Gautam Adani’s gas retailing unit is among firms that submitted 400 bids for the 86 areas the Indian government offered in its latest auction for city-gas licenses.
Adani Gas Ltd bid for 32 licenses, chief executive officer Rajeev Sharma said on Wednesday, while its joint venture with Indian Oil Corp. (IOC) bid for 20. A unit of state gas utility GAIL India Ltd bid for “close to 30 cities,"" the Press Trust of India reported, without saying where it got the information. India Gas Solutions, a joint venture between BP Plc and Reliance Industries Ltd., scrapped its plans to participate, according to PTI.
“We have got unprecedented response,"" Petroleum & Natural Gas Regulatory Board Chairman D.K. Sarraf said by phone, declining to identify the bidders. “This will be a big boost to India’s effort toward increasing gas consumption.""
Evaluation of the bids in the ninth round of auctions will run from July 12 to July 18, and licenses are expected to be awarded by October, the PNGRB said Tuesday. The regulator awarded a combined 56 licenses out of 106 areas offered in previous rounds since 2009.
India is seeking to double the share of natural gas in the country’s energy mix to 15 percent by 2030, while slashing emissions by a third. The country, which the World Bank said in 2016 was home to 14 of the 30 most polluted cities on the planet, is building gas pipelines and new import facilities to increase use of the fuel. The areas in this week’s auction cover almost a quarter of the nation and are aimed bringing gas to 29 percent of its 1.3 billion people.
The licenses in the latest round are expected to fetch investments worth  ₹ 70,000 crore ($10.2 billion) to develop gas infrastructure, the PNGRB has said. That is about four times the cumulative spending in the sector through March 31, according Crisil Ratings Ltd., the local unit of Standard & Poor’s."
50,2018-08-10,GAIL,"GAIL's net profit of 1,259 crore in the first quarter of 2018-19 fiscal was higher than 1,026 crore in the same period of last financial year

New Delhi: GAIL India Ltd, the country’s largest natural gas marketer, on Friday reported a 23% rise in its April-June quarter net profit on better margins in gas trading and petrochemicals business.  
New Delhi: GAIL India Ltd, the country’s largest natural gas marketer, on Friday reported a 23% rise in its April-June quarter net profit on better margins in gas trading and petrochemicals business. 
Net profit of  ₹ 1,259 crore in the first quarter of 2018-19 fiscal was higher than  ₹ 1,026 crore in the same period of last financial year, the company said in a statement here. The profit was higher “mainly due to better performance by gas trading and petrochemicals segments,"" it said.
Sales were up 50% at  ₹ 17,262 crore. Gross margin (EBITDA) witnessed a growth of 17% from  ₹ 2,015 crore in the first quarter of FY2017-18 to  ₹ 2,363 crore in April-June FY2018-19. GAIL said pre-tax profit for natural gas trading rose 64% to  ₹ 551.33 crore while the same from petrochemical business jumped to  ₹ 207.77 crore from  ₹ 47.29 crore.
Company Chairman and Managing Director B.C. Tripathi said: “While all segments contributed positively to the company’s profit, gas trading and petrochemicals segments performed better than the last quarter due to improved physical performance."" Apart from healthy financial growth in the first quarter, the current financial year also saw important agreements entered by the company, he said.
GAIL inked JV agreement with Greater Calcutta Gas Supply Corporation Ltd (a Government of West Bengal entity) for operating city gas network in Kolkata. It also signed Tolling Agreement with Dhamra LNG Terminal Pvt Ltd for 1.5 million tonnes per annum capacity at Dhamra LNG Terminal, Odisha. Tripathi said city gas distribution (CGD) commercial activities in Varanasi and Cuttack have started.
GAIL Gas Ltd, a 100% subsidiary of GAIL, along with joint ventures participated in 9th CGD bidding which are under evaluation and “GAIL expects to add more geographical areas into its CGD business,"" the statement added."
49,2018-08-17,GAIL,"GAIL wants to invest in 'start-ups in core business areas and non-core areas (like health, social and environment, safety, and security) either directly or indirectly

New Delhi: State-owned GAIL India has sought shareholder nod to amend the charter of the company to invest in start-ups, build solar power plants and set up battery charging stations for electric vehicles as it looks to diversify its portfolio beyond gas and petrochemicals.  
New Delhi: State-owned GAIL India has sought shareholder nod to amend the charter of the company to invest in start-ups, build solar power plants and set up battery charging stations for electric vehicles as it looks to diversify its portfolio beyond gas and petrochemicals. 
The nation’s biggest natural gas transporting and marketing company wants to insert six new sections in the main objects clause of the memorandum of association of the company, according to shareholder notice. 
It wants to invest in “start-ups in core business areas (of natural gas, petrochemicals, and energy) and non-core areas (like health, social and environment, safety, and security) either directly or indirectly"". “The investment can be made through special purpose vehicle (SPV), alternative investment fund (AIF), fund of funds (FoF) and trust,"" it said. 
GAIL said that there is a necessity to adopt new and different pathways to provide clean, cost-effective and efficient mobility services that are safe, reduce dependence on oil imports and achieve more efficient land-use in cities with the least environmental footprints and impacts on human health. With the objective in mind, the firm wants to set up “battery charging stations and providing charging services"" to electric vehicles. With the government planning to make a major shift to electric vehicles by 2030, GAIL felt that charging infrastructure for electric vehicles in India has not been fully developed yet."
48,2018-08-19,GAIL,"ONGC will not sell its stake in Indian Oil and GAIL in the near future as their share prices have fallen from January levels when it first showed interest to do so

New Delhi: State-owned Oil and Natural Gas Corp. Ltd (ONGC) will not sell its stake in Indian Oil Corp. Ltd and GAIL (India) Ltd in the near future as it has used internal resources to repay close to a third of the  ₹  24,881 crore loan it had taken to buy Hindustan Petroleum Corp Ltd (HPCL), people with direct knowledge of the matter said. ONGC had in January received government approval to sell its 13.77% stake in Indian Oil and 4.86% stake in GAIL to help fund the  ₹  36,915 crore acquisition of HPCL. 
New Delhi: State-owned Oil and Natural Gas Corp. Ltd (ONGC) will not sell its stake in Indian Oil Corp. Ltd and GAIL (India) Ltd in the near future as it has used internal resources to repay close to a third of the  ₹  24,881 crore loan it had taken to buy Hindustan Petroleum Corp Ltd (HPCL), people with direct knowledge of the matter said. ONGC had in January received government approval to sell its 13.77% stake in Indian Oil and 4.86% stake in GAIL to help fund the  ₹  36,915 crore acquisition of HPCL.
“Indian Oil shares were trading at around  ₹  195 in January and it is now at  ₹  159 (Friday’s closing). It doesn’t make sense to sell the shares at such a big loss,"" this person said, requesting anonymity.
At Friday’s closing price of  ₹  159.60, ONGC’s shareholding in Indian Oil would be worth  ₹  21,343 crore as against  ₹  26,200 crore in January. At Friday’s closing price of  ₹  387.25, ONGC’s shareholding in GAIL was worth  ₹  4,244 crore.
“We are generating enough resources internally thanks to a rebound in oil prices. We used these to bring down the borrowing for HPCL acquisition to  ₹  20,000-21,000 crore in the first quarter and are repaying another  ₹  3,000-4,000 crore in the current quarter. Effectively, we have repaid  ₹  7,800 crore,"" the person said.
ONGC had borrowed  ₹  24,881 crores on a short-term loan to fund buying the government’s 51.11% stake in HPCL. The remaining came from its cash reserves.
According to the person quoted above, the pace of repayment may slow down in the third and fourth quarters owing to outgo on taxes and dividend as also the fact that capital spending would peak by then.
Initially, ONGC considered selling its stake in Indian Oil and GAIL India to fund the acquisition, but it has never found the right price to offload the shares, he said.
The short-term loan ONGC availed had a provision to prepay without any penalty.
ONGC had held talks with Life Insurance Corporation of India (LIC) for selling Indian Oil and GAIL shares but the state-owned insurer insisted on buying them at 10% discount to the prevailing price. ONGC thus decided against the share sale.
ONGC’s purchase of HPCL created India’s first integrated oil company. This was ONGC’s biggest acquisition and second buyout of 2017-18 after its  ₹  7,738 crore acquisition of 80% stake in Gujarat State Petroleum Corp.’s KG basin gas block.
HPCL added 23.8 million tonnes of annual oil refining capacity to ONGC’s portfolio, making it the third-largest refiner in the country after Indian Oil and Reliance Industries Ltd.
ONGC already is majority owner of Mangalore Refinery and Petrochemicals Ltd, which has a 15-million tonne refinery."
47,2018-08-28,GAIL,"GAIL India  has launched a website for online bookings of pipeline capacity to ship gas across the country

New Delhi/Mumbai: tate-run GAIL India Ltd, India’s largest natural gas pipeline operator, has invited users to book surplus network capacity online as the country prepares to create a distribution hub that sets benchmark prices. 
New Delhi/Mumbai: tate-run GAIL India Ltd, India’s largest natural gas pipeline operator, has invited users to book surplus network capacity online as the country prepares to create a distribution hub that sets benchmark prices.
GAIL India Ltd, which controls 70% of the nation’s network, on Monday launched a website for online bookings of pipeline capacity to ship gas across the country. GAIL, with 11,400 kilometres (7,084 miles) pipelines, is investing  ₹ 25,000 crore ($3.6 billion) to add another 5,000 kilometres, Chairman Bhuwan Chandra Tripathi said.
Greater sharing of infrastructure will allow quicker trading and movement of natural gas supplies and boost utilisation of GAIL’s pipelines. The government is looking to cut emissions and its oil import bill by doubling the share of gas in the energy mix to 15%.
“This is going to pave the foundation for the gas hub,"" Tripathi said. “The online booking allows transparent and hassle-free access and increases the ease of operations, and pushes the country toward a gas-based economy.""
GAIL already has more than a hundred customers using its pipeline network on an open-access basis. Once the gas hub is operational, it will increase utilisation of the company’s pipelines, which are operating at half capacity, Tripathi said.
The Petroleum and Natural Gas Regulatory Board, which has been tasked with setting up the gas-trading exchange, expects the hub to be operational by December. The Cabinet is expected to approve the gas exchange plan “soon,"" Oil Minister Dharmendra Pradhan said Monday."
46,2018-09-10,GAIL,"Three or more  PSUs would be included in the CPSE ETF basket to replace GAIL, EIL, Container Corp and the number would depend upon the value of the scrip and the corresponding weightage in the ETF basket, say officials

New Delhi: The Finance Ministry is likely to replace GAIL, Engineers India Ltd (EIL) and Container Corporation with new PSUs in the CPSE Exchange Traded Fund (ETF) since the government holding in these companies has fallen below 55%. 
New Delhi: The Finance Ministry is likely to replace GAIL, Engineers India Ltd (EIL) and Container Corporation with new PSUs in the CPSE Exchange Traded Fund (ETF) since the government holding in these companies has fallen below 55%.
CPSE ETF, which functions like a mutual fund scheme, comprises scrips of 10 bluechip PSUs namely ONGC, Coal India, IOC, Oil India, PFC, Bharat Electronics, REC, GAIL, EIL and Container Corporation of India.
Officials said three or more PSUs would be included in the CPSE ETF basket to replace GAIL, EIL and Container Corp and the number would depend upon the value of the scrip and the corresponding weightage in the ETF basket.
GAIL India, Container Corp and EIL have weightage of 11.25%, 5.08% and 2.28%, respectively in CPSE ETF.
CPSE ETF was set up in 2014 and the government has so far sold stake in the 10 companies in the basket in three tranches, thereby raising  ₹ 11,500 crore.
Currently, the government holds 53.34%, 54.80% and 52.02% stakes in GAIL, Container Corp and EIL, respectively.
When CPSE ETF was set up, a limit was fixed such that the stake sales could take place till the government holding in the 10 constituent companies reaches 55%. “Since the government holding in three CPSEs have fallen below 55%, we need to replace them with new scrips. The number of companies to be included in the basket would depend on the weightage these new scrips would carry in the CPSE ETF basket,"" an official told PTI.
ICICI Securities has been appointed as an adviser for the fourth tranche of the ETF, which will be launched once the Fund is reconstituted, the official said.
A final call on this would be taken by the inter-ministerial panel, chaired by Finance Minister Arun Jaitley. Through the three tranches of CPSE ETF, the government has already raised  ₹ 11,500 crore -  ₹ 3,000 crore from the first tranche in March 2014;  ₹ 6,000 crore from the second in January 2017 and  ₹ 2,500 crore from the third in March 2017.
The government has budgeted to raise  ₹ 80,000 crore through disinvestment in the current fiscal. It has already mopped up  ₹ 9,220 crore so far."
