,Date,Company,Article
30,2019-08-07,HCL,"HCL posts a revenue growth of 4.2% quarter-on-quarter and 17.0% year-on-year in constant currency termsHCL launches ‘HCL Software’, a new business unit that will provide modernized software products to businesses to help them transform their environment

Noida-based HCL Technologies on Wednesday reported a 13.5% quarter-on-quarter decline in net profit for the April-June quarter. The net profit stood at  ₹2,220 crore as compared to  ₹2,568 in the previous quarter.
In terms of revenue growth, the IT major posted a revenue growth of 4.2% quarter-on-quarter and 17.0% year-on-year in constant currency terms, which according to C. Vijayakumar, President & CEO, HCL Technologies is a historic peak performance. ""With our current momentum, we aspire to register an industry leading organic growth in FY20. While our margins this quarter were muted in line with our investment strategy to leverage future growth opportunities, I am confident that our time-tested operating model will deliver margins within our guided range this year,"" he said in a press statement.
The company said the 17% Y-o-Y growth was led by double digit growth across its three segments: IT and business services grew 18.1%, products & platforms 15.2%, engineering and R&D services 13.3% (on Y-o-Y constant currency basis).
In terms of future guidance, the management expects HCL Tech to grow between 14.0% to 16.0% in constant currency for financial year 2019-20. The revenue guidance is based on FY19 (April to March) average exchange rates. The above constant currency guidance translates to 13.3% to 15.3% in dollar terms based on June 30, 2019 rates.
In December 2018, HCL Technologies announced the decision to acquire IBM software products for a total of $1.8 billion that was closed only at the end of the June quarter.
Sanchit Vir Gogia, CEO of Greyhound Research, said: ""The decision by HCL Technologies to acquire software from IBM is part of the company’s attempt to be IP driven and drive growth on the back of it. While in theory this bold move is a step in the right direction and supposed to act as a shot-in-the-arm for HCL, but the ground reality is that these IBM products come with a ton of baggage that can potentially throw a spanner in the works."" He added that developing and scaling standalone SaaS (software as a service) products will require a net-new approach from HCL Technologies and the one key change that HCL Technologies must bring in, is to appoint country and vertical specific resellers for this new software to ensure it continues to add on the customer base and add to the revenue stream.
In other highlights, HCL launched ‘HCL Software’, a new business unit that will providemodernized software products to businesses to help them transform their environment and completed the acquisition of digital transformation consulting firm Strong-Bridge Envision (SBE). According to brokerage firm Reliance Securities, these investments will bear fruit over the next few quarters, driving revenue/profit growth.
In terms of hiring, the company added 16,332 people (gross) and 5,935 staff (net) during the quarter to take its total head count to 1,43,900 at the end of the June 2019 quarter while attrition in the IT services business on the past 12-month basis stood at 17.3% which the company expects to come down in the coming quarters."
29,2019-08-08,HCL,"Benefit of  revenue acceleration was negated by a steep fall in profitability to 17.1%, down 1.8 percentage pointsApart from IBM product acquisition related costs, a significant part of the incremental growth last quarter is on-site dependent, which has low margin

Shares of HCL Technologies Ltd lost about 10% since its March quarter results, underperforming the Nifty IT index, due to concerns over growth and profitability. The June quarter results will reassure investors to some extent.
Constant currency revenues grew 4.2% from the March quarter, better than the most optimistic estimate on the Street. From a year ago, they are up 17%, the highest in recent years. Excluding the benefit of a recent acquisition, sequential revenue growth stood at 3.8%, which is healthy.
However, the benefit of revenue acceleration was negated by a steep fall in profitability to 17.1%. It is down a good 1.8 percentage points from the March quarter. As a consequence, operating earnings (earnings before interest and tax ) in dollar terms fell 6.3% sequentially. “Management already guided that Q1 margins will be weak owing to IBM products acquisition led transition costs while revenues would be absent and flow only from Q2. However, quantum of margin drop is steep,"" said an analyst on condition of anonymity.
Apart from IBM product acquisition related costs, a significant part of the incremental growth last quarter is on-site dependent, which has low margin.
Even so, the company retained the 18.5-19.5% margin guidance for the full year. “I know that there is a bit of a climb from 17.1%; but we have an action plan,"" said C. Vijayakumar, president and chief executive officer of HCL Technologies.
The plan involves cost rationalization and revenue generation from recent investments. The IBM products acquisition will begin generating revenues from the current quarter, covering the costs of this investment. Investments and spends in the engineering division are projected to moderate. Further, the management plans to optimize the on-site-offshore mix and rationalize several other costs.
The steps will aid HCL Technologies’ profitability. But how well the management will succeed in eking out the gains will be known only when it delivers the September quarter results. Otherwise, it is confident of delivering 14-16% constant currency revenue growth it had guided for FY20.
Deal bookings moderated a bit last quarter, but the pipeline is strong. This should help the HCL Technologies stock, especially given its undemanding valuations and recent underperformance. “Potential acceleration in revenue growth, encouraging investments in applications business and momentum of large deals have been completely ignored,"" Kotak Institutional Equities said in a note. “To be clear, we do not like the products strategy of HCL, but find valuations at 12 times FY2021 estimated earnings difficult to ignore."""
28,2019-08-08,HCL,"NSE auto index surged over 3% while many banking stocks also posted strong gainsHigher tax on FPIs has adversely impacted market sentiments: Analysts

Indian markets surged today after news agency Reuters, citing sources, reported that the government is likely to exempt foreign portfolio investors from an increase in taxes that was part of the budget. The budget announcement on taxation has adversely impacted investor sentiments and is reflected in the FPI outflows from the equity markets. Since budget, Indian markets have fallen nearly 8%.
At day's high, the Sensex surged over 700 points before closing 636 points higher at 37,327. The Nifty regained 11,000 mark, settling 1.6% higher at 11,032.
Investors sentiment were also boosted after Reserve Bank of India on Wednesday cut 35 basis points repo rate and promised liquidity support to financial sector.
""Markets today started to sense some relief coming in for the capital markets and clarification or rollback of surcharge on FPIs. The recent round of market correction was led by FII selloff post the budget,"" said Devang Mehta, head of equity advisory at Centrum Wealth Management.
""Some confidence boosting measure for the economy is expected as finance ministry seems to be engaging in extensive discussions with industry participants. However, its too early to speculate on policy decisions, but a bounceback after such a huge fall was not entirely unexpected.""
Banking and auto stocks led the gains today. The NSE auto index rose 3%, with Tata Motors surging 5.6%, Apollo Tyres 5% and TVS Motor 4%. Other top gainers in the auto pack included Bajaj Auto, M&M and Ashok Leyland, up between 3% and 5%.
Among banking stocks, HDFC Bank rose 2.5% while ICICI Bank and SBI gained nearly 2% each.
""(Larger than expected rate cut) clearly shows RBI's concern about the growth performance and urgency to take measures to revive growth,"" said Sujan Hajra, chief economist and executive director at Anand Rathi Shares & Stock Brokers.
HCL Technologies Ltd gained 6.5% after the company said its revenue in constant currency terms grew 17% year on year and 7.7% on sequential basis.
Among losers, Tata Steel Ltd fell 4% after the company reported a 63% slump in its net profit for June quarter to  ₹702 crore from  ₹1934 crore a year ago."
27,2019-08-08,HCL,"Market capitalisation rises by  ₹8,915 crore after Q1 resultsIt was the top gainer among the frontline companies on both the key indices

New Delhi: Shares of HCL Technologies jumped over 6% on Thursday after the company's revenue from operations rose 18.3% in June quarter.
The scrip rose 6.43% to close at  ₹1,088 on the BSE. Intra-day, the stock zoomed 7.11% to  ₹1,095.
On the NSE, shares jumped 6.41% to close at  ₹1,088.25.
It was the top gainer among the frontline companies on both the key indices.
The company's market valuation rose  ₹8,915.25 crore to  ₹1,47,567.25 crore on the BSE.
In terms of volume, 1.31 lakh shares were traded on the BSE, while over 62 lakh shares were traded on the NSE.
""HCL Technologies kicked-off 2019-20 with revenue beating expectations,"" Edelweiss Research said in a report.
The company on Wednesday reported a 8.2% fall in consolidated net profit to  ₹2,230 crore for the June quarter, and said it was ""cautiously optimistic"" about growth in the ongoing fiscal.
HCL Technologies' net profit stood at  ₹2,431 crore in the year-ago period. Its revenue from operations rose 18.3% to  ₹16,427 crore in the June quarter from  ₹13,878 crore a year ago.
The company has maintained its forecast of 2019-20 revenue growth to be between 14-16% in constant currency terms. 
This story has been published from a wire agency feed without modifications to the text. Only the headline has been changed."
26,2019-08-12,HCL,"Profitability softened at large companies as well, with HCL Tech suffering a significant hitExcept Infosys Ltd and HCL Technologies Ltd, revenue growth at most front-line IT firms lagged Street estimates

Global headwinds and the resultant weakness in financial services, a large business vertical, weighed on the growth rates of IT firms in June quarter. However, order wins and deal pipelines remain strong to keep growth hopes alive.
Except Infosys Ltd and HCL Technologies Ltd, revenue growth at most front-line IT firms lagged Street estimates. Growth at Tata Consultancy Services Ltd (TCS), the largest company, moderated from the March quarter. Wipro Ltd and Tech Mahindra Ltd reported lacklustre performance.
The slowdown is more pronounced at second-rung firms. High client concentration and slowdown in revenues adversely impacted the profitability of these firms compared to their larger peers. “Mid-tier companies witnessed slowdown in revenue growth on year-on-year comparison to low teens from high teens earlier. Slowdown in growth from large clients and a few client-specific challenges contributed to weak results,"" analysts at Kotak Institutional Equities said in a note. “Mid-tier companies have a strong leverage to growth; slowdown in the same has resulted in margin contraction across all companies.""
Profitability softened at large companies as well, with HCL Tech suffering a significant hit. Talent crunch, high subcontracting, deal transition and visa costs impacted profitability. Without the support of currency, profitability can remain under pressure for FY20, said the Kotak analysts.
Even so, as one analyst at a domestic broking firm pointed out some time back, relative to other sectors IT companies’ earnings have been less volatile.
Further order bookings and pipeline across the firms remain strong, providing good visibility. “Total contract value (TCV) of deal wins has been strong across all companies, reflecting a demand environment that is still reasonably good,"" analysts at Kotak said. “We appreciate that TCV may not be a reliable indicator for growth due to lack of clarity on renewals of existing business. On the other hand, it is a good indicator for momentum in wins, something that has been comforting up to now.""
Tracking the strong deal momentum, Infosys raised its lower end of the revenue growth guidance for FY20 by one percentage point. HCL Tech is confident of meeting its revenue growth guidance for the full year. TCS, despite pinning growth momentum hopes on the second quarter, is confident about prospects and is stepping-up hiring. Similarly, Tech Mahindra reported strong deal wins for the June quarter.
In comparison, Wipro announced tepid sequential revenue growth guidance of 0-2%. Similarly, company-specific troubles mean growth at Cognizant Technology Solutions Corp. is expected to remain subdued in the near term. The variation in performance and growth profiles explain the valuation gap between Wipro, Tech Mahindra and others. But valuations of other front-line companies at one-year forward earnings estimates are not cheap either."
