,Date,Company,Article
72,2018-12-07,HCL,"Apart from the software assets, the HCL-IBM deal brings with it 5,000 clients, which HCL Technologies believes will enhance existing business

Mumbai: Investors in the Shiv Nadar-controlled fourth-largest Indian IT services provider, HCL Technologies Ltd, were not enthused with its Friday announcement that HCL Tech will buy select IBM software products for $1.8 billion. HCL Tech shares fell as much as 7.60%, on a day the BSE IT Index traded lower and Sensex was higher. 
Mumbai: Investors in the Shiv Nadar-controlled fourth-largest Indian IT services provider, HCL Technologies Ltd, were not enthused with its Friday announcement that HCL Tech will buy select IBM software products for $1.8 billion. HCL Tech shares fell as much as 7.60%, on a day the BSE IT Index traded lower and Sensex was higher.
The HCL-IBM deal, which accounts for nearly 22% of HCL Tech’s annualized revenue, is expected to close by mid-2019, subject to completion of applicable regulatory reviews. It is also the largest acquisition by any Indian IT services provider till date. Tech Mahindra Ltd acquired Satyam Computer Services for $1.23 billion in March 2012 while HCL Technologies bought the Axon Group for $731 million (Infosys was in the race but had made a lower bid at $678 million).
Both companies appear to have struck this deal in a bid to focus on their core strategies. On its part, HCL wants to sharpen its focus on its “products and platforms"" business, which accounted for $250 million of its revenue in the September quarter, in a bid to grow its intellectual property (IP) business.
On the other hand, the deal follows International Business Machines Corp.’s (IBM’s) attempt to make a dent in the open source hybrid cloud market. It was only a couple of months back that the Big Blue agreed to buy open source cloud services provider Red Hat Inc. for $33 billion.
ALSO READ | Why does Big Blue really want a Red Hat?
HCL and IBM have an ongoing intellectual property (IP) partnership for five of the products in the deal announced on Friday. The software cumulatively represent a total addressable market of more than $50 billion.
According to HCL Technologies CEO C. Vijayakumar, HCL is acquiring these products that are in “large growing market areas like security, marketing and commerce, which are strategic segments for HCL... In addition, we see tremendous potential for creating compelling ‘as-a-service’ offerings by combining these products with our Mode-1 and Mode-2 services"".
HCL’s so-called Mode 1 refers to its application, development and maintenance (ADM) and infrastructure services. Mode 2 refers to its growth businesses that are oriented towards digital technology, such as mobility, Internet of Things (IoT), automation and Artificial Intelligence (AI).
DRYiCE, for instance, is a division of HCL Technologies that is focused on building AI-powered “products and platforms"" for the digital world. HCL Tech’s Mode 3 refers to the “products and platforms"" business, which has more IP-based solutions that provide higher margins, are better for business and provide longer-term engagements.
However, HCL Tech’s decision to acquire software from IBM as part of its attempt to be IP-driven and drive growth on back of it may be “good in theory, and the bold move is a step in the right direction, but the ground reality is that these products come with a ton of baggage that can potentially throw a spanner in the works"", according to Sanchit Vir Gogia, chief analyst, founder and CEO of Greyhound Research, a market research and analysis firm.
Gogia argues that most of the products in the HCL-IBM deal have been sold “as part of a large Strategic Outsourcing or a Managed Services deal and not as independent products"". This implies that so far these products “have been sold on back of the solid relationship with IBM, existing services contracts and most importantly, the ability to covert CAPEX (capital expenditure) to OPEX (operating expenditure) thanks to IBM’s financing arm"".
“When sold independently, HCL Technologies will need to add ammunition in terms of integrations with other key third-party providers, soft licensing measures, the ability for these products to work across multiple cloud providers and most of all, the arms and legs to allow for easy deployment and ongoing management,"" says Gogia. He believes “HCL Tech can turn the deal in its favour if it offers concrete guidance on its commitment to code and R&D overall"".
HCL Technologies, on its part, believes that the addition of a customer base of about 5,000 clients to its existing repertoire will help it make the deal enhance its existing business. The company is also expecting that the deal will add $650 million annually to its existing business ($625 million in the first year of completion).
Mint’s Ravindra Sonavane contributed to this story."
73,2018-12-08,HCL,"HCL will use $1.475 billion of its own cash and borrow $300 million to finance the transaction, which the management expects to close by mid-2019.

New Delhi: HCL Technologies Ltd will spend $1.78 billion to buy eight software products from International Business Machines Corp. (IBM), it announced on Friday, unveiling the single-largest acquisition by an Indian information technology (IT) services company and a buyout that is unlike any made by risk-averse home-grown IT firms.  
New Delhi: HCL Technologies Ltd will spend $1.78 billion to buy eight software products from International Business Machines Corp. (IBM), it announced on Friday, unveiling the single-largest acquisition by an Indian information technology (IT) services company and a buyout that is unlike any made by risk-averse home-grown IT firms."
71,2018-12-12,HCL,"Investors have questions about HCL Tech's ability to scale up the products business. HCL Tech will have to market the product and build a sales team, which is easier said than done

HCL Technologies Ltd’s $1.8-billion acquisition of some software products from International Business Machines Corp. (IBM), touted to be its biggest ever, met with much scepticism. The stock has lost 5% since it announced the acquisition last week. 
HCL Technologies Ltd’s $1.8-billion acquisition of some software products from International Business Machines Corp. (IBM), touted to be its biggest ever, met with much scepticism. The stock has lost 5% since it announced the acquisition last week.
The firm’s argument is that the acquisition will give a leg-up to its products and platforms business, and the share of this segment will rise from 12% of revenues to 17%. HCL Tech aims to leverage the market access provided by these products to cross-sell its existing services, benefiting in the process. Still, everybody is not convinced.
Some of the products being acquired are seen to be mature technologies with a declining market share. “The company has not provided individual product revenue contribution. Concentration of revenues in favour of legacy products could be a risk to overall growth of the portfolio,"" analysts at Nomura said in a note.
Investors also have questions about HCL Tech’s ability to scale up the products business. Being a software services company, it has limited capability in product sales. True, the IBM deal gives it headway. But HCL Tech will have to market the product and build a sales team, which is easier said than done. “(HCL’s) the capabilities for product sales are untested and HCL will be handicapped in tapping new clientele in competition with entrenched software vendors,"" add analysts at Nomura Research.
HCL Tech may step up investments in sales and brand development. But this can raise costs and weigh on profitability. Further, post the large payout for the acquisition, cash levels at the company will reduce considerably, limiting the scope for tactical investments in future. Maintaining its dividend payout ratio could also become a challenge if operating cash flows decrease or capex rises from current levels.
While the concerns are expected to weigh on stock performance, much depends on execution. If HCL Tech succeeds in product platform investments, then the company can emerge as end-to-end solutions provider, point out analysts at Elara Securities (India) Pvt. Ltd. The reaction of the stock, however, shows that not everyone agrees."
70,2019-01-01,HCL,"Shilpa Medicare said it has received approval from the US health regulator for Irinotecan HCL injection, used for treatment of certain kind of cancers

New Delhi: Shilpa Medicare Tuesday said it has received approval from the US health regulator for Irinotecan HCL injection, used for treatment of certain kind of cancers. The company has received US Food and Drug Administration (USFDA) approval for its ANDA Irinotecan HCL injection USP in the strengths 40 mg/2mL and 100 mg/5mL (20mg/mL) single dose vials, Shilpa Medicare said in a BSE filing. 
New Delhi: Shilpa Medicare Tuesday said it has received approval from the US health regulator for Irinotecan HCL injection, used for treatment of certain kind of cancers. The company has received US Food and Drug Administration (USFDA) approval for its ANDA Irinotecan HCL injection USP in the strengths 40 mg/2mL and 100 mg/5mL (20mg/mL) single dose vials, Shilpa Medicare said in a BSE filing.
Irinotecan injection is used in the treatment of patients with metastatic carcinoma of the colon or rectum, the company added.
Quoting IQVIA MAT second quarter 2018 data, Shilpa Medicare said the US market for Irinotecan HCL is approximately USD 18 million.
Shares of Shilpa Medicare were trading 3.80 per cent up at  ₹ 398.65 apiece on BSE.
This story has been published from a wire agency feed without modifications to the text."
69,2019-01-21,HCL,"The first elephant is the turmoil in the US equity markets, which indicates the end of a long expansion 

Information technology (IT) analysts are largely a happy bunch. Their primary arguments for an overall rosy macro outlook include comments that there appear to be no headwinds seen on clients’ IT budgets because of the deal renewal cycles as well as the fact that digital spending is now becoming “non-discretionary"". The latter supposedly means that IT departments at client firms that outsource to service providers have no choice but to spend large amounts on digital projects.
Early last year in this column, I predicted that IT services firms would have a good 2018, primarily because of large deals being recycled out into the market, and because of early “digital"" efforts made by clients now moving into the mainstream. The first phenomenon is a cyclical one, and it appears as if the effect of the expansion caused by deal renewals will continue into 2019.
As the spending on digital goes from the ideation stage (where Indian IT services firms have a lacklustre presence) to the execution stage, which allows them to compete on a level playing field with others, Indian players are seen benefiting from clients’ budgets. The other macro shift that worked in favour of Indian service providers in 2018 was the fall in the value of the rupee vis-à-vis the dollar.
While the positive impacts are clear, each enterprise has had firm-specific factors affecting performance. And so, much of the commentary this quarter has started to focus on the relative differences among firms. Analysts seem to favour stocks such as Tata Consultancy Services Ltd, HCL Technologies Ltd and Infosys Ltd, while being lukewarm towards others.
There is also speculation about probable consolidation among mid-cap providers, especially where existing investors, such as private equity firms or large single investors, look to monetize their stake through exits and forced mergers. The promoter equity at these firms is now dwarfed by the private equity stake, and investors will have to look to moves by private equity firms as a leading indicator of stock price performance.
Last week, Mint carried an article about moves by Baring PE Asia, KKR and Café Coffee Day’s V.G. Siddhartha, which could massively impact at least a couple of mid-cap providers that are already billion-dollar revenue bracket firms.
The rest of the analysis seems to focus on the expected spending from the banking, financial services and insurance (BFSI) sector, the largest sector from a revenue perspective for almost all Indian IT services firms. This analysis focuses on two vectors.
The first vector is on the interplay between insourcing of work through the BFSI sector’s India-based in-house delivery centres and outsourcing of work to IT services firms.
The second vector is on the apparent spending pattern within BFSI, which is seeing cautious expansion into digital running alongside continued spending on older systems.
Such fine splitting of hairs while analysing recent results and near-term forecasts is but to be expected in a sector that has grown mature, and by some accounts, past its “use by"" date. In my opinion, however, most analysts seem to have completely missed three elephants in the room.
The first elephant is the turmoil in the US equity markets, which indicates the end of a long expansion and the possible start of economic contraction in that market. This contraction is based on fears of a “bull in a China shop"" (quite literally) attitude toward US trade with China, increasing rhetoric around US trade wars and slowing growth in both China and Europe.
After a decade of growth, many investors are worried that a contraction is near, and December’s jitters on the heels of a threatened fifth raise of interest rates by America’s Federal Reserve was only a preview. Markets in the US have calmed over the past few days and US stocks have seen a rebound, but only because another interest rate action by the Fed now seems less likely, after the Federal Reserve officials repeatedly assured investors that they were sensitive to concerns about the economy and would be flexible and patient with further interest rate hikes. However, many factors behind last year’s alarming and precipitous drop loom in the shadows.
IT analysts also seem blind to two other pachyderms: political upheaval in both the US and in the UK, still two of the largest markets for Indian IT. The first is the ongoing battle between US President Donald Trump and those who oppose his border wall proposal and the latter is the complete chaos on Brexit.
The US is now well into its longest government shutdown, with Trump and opposition Democrats casting blame for the deadlock on each other. Whoever is to blame, there is no doubt at all that the shutdown will exact a massive price on the US economy; the shutdown’s total costs will far outweigh the $5.7 billion for the wall that Trump and the Democrats are quarrelling about. According to Standard & Poor’s, the last time the US government shut down for 16 days in 2013, the economy took a $24 billion hit. This shutdown is 31 days old and counting.
Start to get very picky with your investments in Indian IT.
Siddharth Pai is founder of Siana Capital, a venture fund management company focused on tech."
68,2019-01-27,HCL,"A lot of events are lined up - like the Budget, Federal Open Market Committee (FOMC) meet, quarterly results of Axis Bank, ICICI Bank, Bajaj FinanceInvestors are also likely to take cues from foreign fund flow

New Delhi: The stock market is likely to track a host of key domestic and global events this week like the interim Budget for 2019-20, January derivatives expiry, quarterly earnings from blue-chips and the US Fed interest rate decision, say experts.
""Market may extend the range bound movement as global risk factors like the US-China trade talks and growth concern continued to gain investors' attention,"" said Vinod Nair, Head of Research, Geojit Financial Services.
A lot of events are lined up - like the Budget, Federal Open Market Committee (FOMC) meet, quarterly results of Axis Bank, ICICI Bank, Bajaj Finance, IOC and HCL, said Mustafa Nadeem, CEO, Epic Research.
Among major quarterly results to be announced this week are from Bank of India, Canara Bank, Axis Bank, Bank of Baroda, HCL Technologies, HDFC, Bajaj Auto, ICICI Bank, Hero MotoCorp, Dr Reddy's Laboratories and SBI.
The government on February 1, would unveil the interim Budget for 2019-20.
Investors are also likely to take cues from foreign fund flow. Going ahead, key corporate results and trade negotiations between the US and China will dictate market sentiment, said Paras Bothra, President, Equity Research, Ashika Stock Broking.
According to provisional data on BSE, foreign portfolio investors (FPIs) bought shares worth a net of  ₹689.28 crore, while domestic institutional investors (DIIs) sold shares worth  ₹147.35 crore on Friday.
January month derivatives expiry on Thursday and announcement of PMI data for the manufacturing sector on Friday may also influence trading sentiment, experts said.
During the past week, the BSE benchmark Sensex fell 361 points and the NSE Nifty fell 126 points.
This story has been published from a wire agency feed without modifications to the text. Only the headline has been changed."
66,2019-01-29,HCL,"The firm’s dollar revenue improved sequentially to $2.2 bn in Oct-DecHCL Tech’s performance in the October-December quarter was better than its Bengaluru-based rivals, Infosys Ltd and Wipro Ltd

HCL Technologies Ltd on Tuesday reported a 4.9% sequential increase in its dollar revenue for the October-December quarter, the fastest among the large companies in India’s $167 billion information technology (IT) outsourcing sector.
HCL Tech’s dollar revenue improved sequentially to $2.2 billion in the quarter, while revenue grew 10.8% year-on-year (y-o-y).
In constant currency terms, the company’s revenue rose 5.6% on a sequential basis.
Net profit was at $364 million in the December quarter when compared with $357 million in the September quarter.
However, its operating margin fell 30 basis points from 19.9% to 19.6% in the quarter under consideration, on account of rising wages. One basis point is one-hundredth of a percentage point.
A Bloomberg survey of 29 analysts had forecast revenue of $2.18 billion, or  ₹15,514.1 crore, besides profit of $357.54 million, or  ₹2,541 crore, for the December quarter.
Noida-based HCL Tech’s performance in the October-December quarter was better than its Bengaluru-based rivals, Infosys Ltd and Wipro Ltd, which reported 2.2% and 1.8% sequential dollar revenue growth, respectively. Mumbai-based Tata Consultancy Services Ltd, which does more business than Infosys and Wipro put together, reported 0.67% growth.
For now, HCL Tech’s growth continues to be driven by higher business from its infrastructure management services unit, besides revenue from its acquisition strategy.
HCL Tech expects its full-year revenue for 2018-19 to grow at the upper-end of its guidance of 9.5-11.5%. Mumbai-based TCS, which does not provide a growth outlook, is expected to grow over 11%, while Infosys expects at-best 9% growth.
Industry body Nasscom expects revenue for the industry to grow between 7% and 9% in constant currency terms.
“I’m very happy with the outstanding performance delivered by us during this quarter,"" said HCL Technologies chief executive officer C. Vijayakumar.
“For now, we see healthy demand and we don’t see any impact on our client spends from either the continued shutdown in the US or any macroeconomic slowdown.""
“HCL Tech delivered impressive revenues growth for the quarter with 5.9% constant currency growth, however, margins perHformance was a tad below estimates,"" said Sanjeev Hota, an analyst with brokerage Sharekhan Ltd.
The brokerage, however, said it continues to have concerns over the company’s $1.8 billion acquisition of eight software products from IBM, which was announced last month.
On Tuesday, HCL shares rose 1.24% to  ₹988.1 on the BSE even as the benchmark Sensex slipped 64 points, or 0.18%, to end the day at 35,592.5 points. HCL Q3 results were announced after market hours."
67,2019-01-29,HCL,"Revenue rose 22.6% to  ₹15,699 crore against  ₹12,808 crore a year agoThe company maintained its FY19 revenue guidance between 9.5% and 11.5% in constant currency basis

New Delhi: Software services major HCL Technologies on Tuesday posted a 19% increase in consolidated net profit to  ₹2,611 crore during the December 2018 quarter. The company registered a net profit of  ₹2,194 crore in the year-ago period.
Revenue rose 22.6% to  ₹15,699 crore, compared with  ₹12,808 crore in the December 2017 quarter.
""Our revenues grew 5.6% sequentially in constant currency terms. We crossed $1.5 billion run rate in our Mode 2 next-generation offerings. We once again set a new bookings record this quarter. We are entering 2019 with a healthy growth outlook backed by the strong relevance of our propositions in the market,"" HCL Technologies president and CEO C Vijayakumar said in the statement.
In dollar terms, net profit rose 7% to $364 million for the December 2018 quarter, while revenue increased 10.8% to $2.2 billion against a year ago.
The company maintained its FY19 revenue guidance between 9.5% and 11.5% in constant currency basis.
The company's board declared an interim dividend of  ₹2 per share for FY19.
The company added 13,191 people (gross) during the quarter, taking its total headcount to 1,32,328 at the end of the December 2018. Attrition in the IT services business on the past 12-month basis was 17.8%.
The story has been published from a wire agency feed without modifications to the text. Only the headline has been changed"
65,2019-01-30,HCL,"Revenues in constant currency terms increased 5.6% on a sequential basisHCL Tech reported a 30 basis point contraction in profit margins to 19.6%

Shares of HCL Technologies Ltd have underperformed the Nifty IT index by more than 17% in the past year. However, the December quarter results released after the market hours should help the stock gain some momentum.
Revenues in constant currency terms increased 5.6% on a sequential basis. Organic growth or revenues excluding the contribution from acquisitions stood at 4.4%, notably higher than the Street’s estimates.
But on the flip side, HCL Tech reported a 30 basis point contraction in profit margins to 19.6%. While analysts were expecting an improvement, it must be noted that most large IT companies saw moderation of profitability in the December quarter, reflecting the general rise in employee costs.
Importantly, the company now says it is confident of growing at the higher end of its 9.5-11.5% revenue growth guidance in constant currency terms. Earlier, it was expecting to meet the mid-point of the growth guidance. The upward revision in growth expectations reflects strong execution and order bookings.
Revenue contribution from top five clients increased from 15.8% in the year-ago quarter to 17.4% last quarter, reflecting revenue accretion from recent large order wins.
The infrastructure services vertical, which generates 36% of HCL Tech’s revenues, grew 16.5% from a year ago. In the earlier two quarters, the segment clocked a growth rate of 2-4%. Growth at the application services business, which generates one-third of total revenues, improved, though the rates were below the company averages.
Among the business verticals, the financial services and manufacturing segments continue to lag. But the management expects the performance to improve this calendar year on the back of strong deal wins. The company did not share the quantum of deal wins in value terms, stating instead that it had another quarter of “record"" order bookings.
Prateek Aggarwal, chief financial officer, said the company has seen strong double-digit growth in order bookings. This should not only help HCL Tech register healthy performance in the current quarter (Q4), but places it well for FY20 as well.
The performance and the commentary should aid the HCL Tech stock, which is trading at a notable discount to larger peers. Over the last year, the stock underperformed the Nifty IT index as the company embarked on intellectual property (IP)-driven investments.
Concerns about the efficacy of IP-related investments and their possible impact on margins contributed to the stock’s underperformance. HCL Tech now plans to focus on execution and is not aggressively looking at such investments. While the commentary and the performance should aid the stock, investors should also keep an eye on the margin trajectory."
