,Date,Company,Article
48,2018-05-22,UltraTech,"With increasing competitive intensity, if UltraTech Cement decides to aggressively chase volume growth, cement prices, which have slowly begun to rise, would suffer again

UltraTech Cement Ltd is on an acquisition spree. The latest addition to its shopping basket is the cement business of Century Textiles and Industries Ltd. 
UltraTech Cement Ltd is on an acquisition spree. The latest addition to its shopping basket is the cement business of Century Textiles and Industries Ltd.
UltraTech will acquire 13.4 million tonnes per annum (mtpa) of Century Textiles’ cement assets for an enterprise value of Rs8,600 crore. With that, the pan-India cement producer’s presence in the eastern (Chhattisgarh), central (Madhya Pradesh) and western (Maharashtra) markets will strengthen further.
Following this acquisition, the company’s domestic capacity will increase nearly 15% to 106 mtpa from 92.6 mtpa (see Chart 1) Its all-India capacity market share will rise from around 20% to 23% by the end of the current fiscal year (FY19). Region-wise, its capacity market share would improve by 7%, 6% and 8% in the central, eastern and western markets, respectively, say analysts. 
Moreover, UltraTech’s cement capacity will stand augmented to 109.9 mtpa including its overseas operations, making it the third-largest cement maker in the world, outside China (see Chart 2). 
While the deal does not give UltraTech Cement access to newer markets, it clearly consolidates the company’s dominant position across these regions. 
This may be good news for the company’s shareholders , but would get its competitors in these regions worried because, despite this being the busy construction season, the sector’s demand growth is not strong enough to support higher prices. And with increasing competitive intensity, if UltraTech Cement decides to aggressively chase volume growth, cement prices, which have slowly begun to rise, would suffer again. 
This is the company’s second acquisition in two years. As for the first one, it is ramping up the 21 mtpa of cement capacities acquired from Jaiprakash Associates Ltd. That, coupled with a ramp-up of capacities by other large cement producers such as Shree Cement Ltd, has kept cement prices in north India under pressure.
So much so that cement prices on an all-India basis inched up in May, but the north remained a laggard.
It should be noted that a final decision on the acquisition of Binani Cement Ltd is still pending. UltraTech Cement is desperately trying to acquire those assets, and ramping up of capacities by the acquirer would also have a bearing on cement prices in Rajasthan. 
As for other regions, cement prices in the west saw the highest increase of Rs14 per bag on a month-on-month to Rs324 per bag in May, showed a monthly cement dealer channel check report by Kotak Institutional Equities. One cement bag weighs 50kg.
The price increase in Maharashtra was moderate at Rs8 per bag from a month earlier. In the central region, prices in Madhya Pradesh fell by Rs5 per bag month-on-month and prices in the east remained flat at Rs337 per bag in May, the report added. 
Meanwhile, the transaction with Century Textiles is subject to the Competition Commission of India’s approval and is expected to be completed in the next six-nine months. 
In any case, the scenario remains challenging as far as input costs are concerned, and if cut-throat competition leads to larger cement companies pushing volumes at the expense of prices, then smaller cement makers may not be able to survive the pressure."
47,2018-05-23,UltraTech,"NCLAT maintained a status quo after hearing the petition by Rajputana Properties, which had challenged the revised resolution plan made by UltraTech for Binani Cement

New Delhi:The National Company Law Appellate Tribunal (NCLAT) on Tuesday refused to stay the corporate insolvency resolution process for Binani Cement Ltd. 
New Delhi:The National Company Law Appellate Tribunal (NCLAT) on Tuesday refused to stay the corporate insolvency resolution process for Binani Cement Ltd.
An NCLAT bench, headed by justice S.J. Mukhopadhyay, maintained a status quo after hearing the petition by Dalmia-Bharat-controlled Rajputana Properties Pvt. Ltd, which had challenged the revised resolution plan made by UltraTech Cement Ltd for debt-ridden Binani Cement. 
Former attorney general Gopal Subramanium, who appeared for Rajputana Properties, sought an order of status quo in view of the appeal pending before the appellate tribunal.
The bench refused to stall the insolvency resolution process and stated that the outcome of the process would be subject to the final decision in the appeal. 
Earlier this month, Rajputana Properties had challenged the 2 May order of the NCLT’s Kolkata bench, which allowed the resolution professional and committee of creditors (CoC) for Binani Cement to consider the revised resolution plan submitted by UltraTech, while offering Rajputana Properties an opportunity to revise its resolution plan of Rs6,930 crore.
UltraTech Cement’s revised offer was at Rs7,900 crore, against its earlier bid of Rs7,200 crore.
On 15 May, the appellate tribunal had asked the resolution professional to continue with the resolution process by submitting the revised resolution plans for the corporate debtor in a sealed cover before the CoC, along with his opinion on questions pertaining to conformity with the Insolvency and Bankruptcy Code.
Binani Industries Ltd, the parent of Binani Cement, has also offered to pay all the dues of its subsidiary to its financial and operational creditors in two weeks, if the tribunal so permitted.
Binani Cement, which was admitted by NCLT in July 2017 for resolution under the IBC, owes over Rs6,500 crore to its lenders. The matter will be next heard on 10 July."
46,2018-05-29,UltraTech,"Dalmia Bharat-controlled Rajputana Properties has challenged NCLAT order allowing lenders to consider UltraTech's revised bid for Binani Cement

New Delhi: The Supreme Court is likely to hear the appeal brought by Dalmia Bharat Ltd-controlled Rajputana Properties Pvt Ltd (RPPL) against a 15 May order of the National Company Law Appellate Tribunal (NCLAT) allowing the committee of creditors (CoC) to consider a revised offer for Binani Cement put forth by UltraTech Cement, next week. 
New Delhi: The Supreme Court is likely to hear the appeal brought by Dalmia Bharat Ltd-controlled Rajputana Properties Pvt Ltd (RPPL) against a 15 May order of the National Company Law Appellate Tribunal (NCLAT) allowing the committee of creditors (CoC) to consider a revised offer for Binani Cement put forth by UltraTech Cement, next week.
The order had also prohibited the resolution professional for Binani Cement Ltd from seeking an opinion from the resolution applicants and other parties on the questions of eligibility.
Simultaneously, it has challenged a 22 May order of the NCLAT that refused to stay the corporate insolvency resolution process for Binani Cement. RPPL has sought stay of both the NCLAT orders on an urgent basis.
Dalmia Bharat has offered to pay Rs6,932.46 crore for Binani Cement whereas UltraTech has raised its bid to Rs7,960 crore and claimed that, in the interest of all stakeholders, its bid should be considered by the lenders.
The matter was mentioned before the apex court by former attorney general Gopal Subramanium.
Seeking urgent listing of the matter and for it to be heard on a day-to-day basis, RPPL sought stay of the impugned orders directing the resolution professional and CoC to consider the resolution plans as per the guidelines prescribed under the 15 May order. 
The appeal holds that through the impugned orders of 15 May and 22 May, NCLAT has erroneously laid down a procedure unknown to the statutory framework devised for the purpose of evaluation of a resolution plan by eliminating scrutiny regarding its legality and eligibility of a resolution applicant under Section 30(3) and 29A of the Insolvency and Bankruptcy Code, 2016 (IBC).
The effect of the 15 May order is that while the legality and correctness of the rejection of a resolution plan submitted by the applicant is pending adjudication before the adjudicating authority, the CoC has been allowed to consider the revised offer of an unsuccessful resolution applicant (UltraTech), it was stated.
On 15 May, an NCLAT bench headed by Justice S.J. Mukhopadhyay had asked the resolution professional to submit the revised resolution plans for the corporate debtor in a sealed cover before the CoC along with his opinion on questions pertaining to conformity with the IBC. The appellate tribunal further asked the CoC to record reasons for accepting or refusing a resolution plan, as well as the opinion of the board of directors. 
The appellate tribunal on 4 May refused to grant an interim stay on a 2 May order of the Kolkata bench of the National Company Law Tribunal (NCLT), which had asked the resolution professional and the CoC to consider the revised bid of UltraTech Cement.
On 2 May, the Kolkata branch of the NCLT had passed an order asking the resolution professional to accept UltraTech’s revised bid of Rs7,900 crore within three days with a provision for Dalmia Bharat to match UltraTech’s offer. This put UltraTech back in the race for acquiring Binani Cement. Thereafter, Dalmia Bharat moved the appellate court to obtain a stay on the NCLT order. NCLAT declined immediate stay.
The appeal is likely to be heard by the top court next week."
45,2018-05-29,UltraTech,"Binani Cement's committee of creditors (CoC) voted in person to approve UltraTech's bid at the meeting on Monday

Mumbai: UltraTech Cement Ltd’s Rs7,950 crore bid to acquire Binani Cement Ltd has received near-unanimous backing from lenders to the distressed building material maker even as a legal battle reached the country’s top court, two people aware of the development said. 
Mumbai: UltraTech Cement Ltd’s Rs7,950 crore bid to acquire Binani Cement Ltd has received near-unanimous backing from lenders to the distressed building material maker even as a legal battle reached the country’s top court, two people aware of the development said.
Binani Cement’s committee of creditors (CoC) voted in person to approve UltraTech’s bid at the meeting on Monday, the people said, requesting anonymity. 
“UltraTech is being supported almost unanimously by the lenders,"" one of the people, a banker, said. “The Supreme Court has not put a stay on the process; so the direction is clear."" 
The acquisition of Binani Cement will, however, be subject to the Supreme Court’s ruling, with a Dalmia Bharat Ltd-led consortium challenging the 15 May order of the National Company Law Appellate Tribunal that allowed lenders to consider UltraTech’s revised offer. The offer was submitted after lenders selected Dalmia as the top bidder. 
The Supreme Court is likely to hear the appeal by Dalmia Bharat next week. The consortium is challenging UltraTech’s eligibility to bid under the Insolvency and Bankruptcy Code, which disallows defaulting promoters from being resolution applicants. Dalmia’s contention is that UltraTech is working in concert with Binani Industries Ltd, the parent of Binani Cement, and is hence a defaulter. 
Piramal Enterprises and Bain Capital are the other members of the Dalmia Bharat-led consortium. 
“The process has been laid out and has to be followed. The (value) maximization is happening beyond the process, which is not correct. It is a lacuna in the law and is being decided by NCLT (National Company Law Tribunal) and SC,"" Ajay Piramal, chairman of Piramal Enterprises, said in an interview. 
Dalmia Bharat has offered lenders Rs6,350 crore to take over Binani. UltraTech, which had originally bid lower, later raised its bid by more than Rs1,000 crore. Binani Cement’s lenders allowed Dalmia to match UltraTech’s bid, but Dalmia chose to challenge the process in court. 
Bankers say the insolvency code allows for “value maximization"" of an asset and NCLT and the Supreme Court are also of the same view. 
Binani Cement owes about Rs6,313 crore to banks and operational creditors, who will be paid back in full under UltraTech’s resolution plan."
44,2018-06-05,UltraTech,"Supreme Court was hearing an appeal by Dalmia Bharat's Rajputana Properties against an NCLAT order allowing lenders to consider UltraTech Cement's revised offer for Binani Cement

New Delhi: The Supreme Court on Monday directed the Committee of Creditors (CoC) of Binani Cement Ltd to proceed with its debt resolution process but said the same would be subject to the final outcome of the case. 
New Delhi: The Supreme Court on Monday directed the Committee of Creditors (CoC) of Binani Cement Ltd to proceed with its debt resolution process but said the same would be subject to the final outcome of the case.
“All we want is that no final order should be passed till 2nd July, the next date of hearing in the case in the apex court"", said former solicitor general Gopal Subramanium, on behalf of Dalmia Cement.
Senior advocate Abhishek Manu Singhvi, representing UltraTech Cement Ltd (one of the bidders) argued, “We have offered Rs1,000 crore more than Dalmia Cement. It has 90% haircut from SBI lenders and income tax department"".
The two-judge vacation bench was hearing an appeal brought by Dalmia Bharat Ltd-controlled Rajputana Properties Pvt. Ltd (RPPL) against a 15 May order of the National Company Law Appellate Tribunal (NCLAT) allowing the CoC to consider a revised offer for Binani Cement put forth by UltraTech Cement.
The order had also prohibited the resolution professional for Binani Cement from seeking an opinion from the resolution applicants and other parties on the questions of eligibility.
Simultaneously, it has challenged a 22 May order of the NCLAT that refused to stay the corporate insolvency resolution process for Binani Cement. RPPL has sought stay of both the NCLAT orders on an urgent basis.
Dalmia Bharat has offered to pay Rs6,932.46 crore for Binani Cement whereas UltraTech has raised its bid to Rs7,960 crore and claimed that, in the interest of all stakeholders, its bid should be considered by the lenders.
Seeking urgent listing of the matter and for it to be heard on a day-to-day basis, Rajputana Properties sought stay of the impugned orders directing the resolution professional and CoC to consider the resolution plans as per the guidelines prescribed under the 15 May order.
The appeal holds that through the impugned orders of 15 May and 22 May, NCLAT has erroneously laid down a procedure unknown to the statutory framework devised for the purpose of evaluation of a resolution plan by eliminating scrutiny regarding its legality and eligibility of a resolution applicant under Section 30(3) and 29A of the Insolvency and Bankruptcy Code, 2016 (IBC).
The effect of the 15 May order is that while the legality and correctness of the rejection of a resolution plan submitted by the applicant is pending adjudication before the adjudicating authority, the CoC has been allowed to consider the revised offer of an unsuccessful resolution applicant (UltraTech), it was stated.
On 15 May, an NCLAT bench headed by Justice S.J. Mukhopadhyay had asked the resolution professional to submit the revised resolution plans for the corporate debtor in a sealed cover before the CoC along with his opinion on questions pertaining to conformity with the IBC. The appellate tribunal further asked the CoC to record reasons for accepting or refusing a resolution plan, as well as the opinion of the board of directors.
The matter will be heard next on 2 July."
43,2018-06-05,UltraTech,"UltraTech Cement had moved the Bombay HC on 21 March against Everest Industries, which was using the marks 'Ultratruf' and 'A One Ultratruf' that were deceptively similar to its own registered mark 'UltraTech'

 Mumbai: UltraTech Cement Ltd has successfully secured its brand in a case of copyright infringement, winning a lawsuit against a firm selling cement brands resembling its own. 
 Mumbai: UltraTech Cement Ltd has successfully secured its brand in a case of copyright infringement, winning a lawsuit against a firm selling cement brands resembling its own.
Billionaire Aditya Birla-owned UltraTech Cement had moved the Bombay high court on 21 March against Everest Industries, which was using the marks “Ultratruf"" and “A One Ultratruf"" that were deceptively similar to its own registered mark “UltraTech"". In intellectual property rights law, this is called passing-off—making a false representation that is likely to induce a person to believe that the goods or services are those of another. Typically, consumer goods and pharmaceutical firms go to court to protect their brands. 
UltraTech said Everest was using the mark “Ultratruf-The Builders Choice"". 
The placement of the mark, its style, font, colour combination, etc, were deceptively similar to the registered mark and, hence, it had sent a cease-and-desist notice to Everest. “Prima facie, the marks ‘Ultratruf-The Builders Choice’ and ‘A One Ultratruf’ used by the defendants are deceptively similar to the plaintiffs’ registered trademark ‘UltraTech’,"" justice S.J. Kathawala observed in his order. “The defendants have adopted the font, style, colour combination, placement of material and the words in such a manner that the products of the defendants looks as if the same are the products of the plaintiffs.""
The court also observed that Everest was deceptively using another brand name, Ambruja, similar to that of Ambuja Cements Ltd. 
The court on 14 May ordered Everest Industries not to use the mark in any manner and directed it to submit to the court  ₹ 10 lakh as costs and damage within two weeks.
“The court receiver appointed by the court confirmed the allegations of UltraTech. The defendants even admitted their mistake before the court,"" said trademark attorney Pranit Nanavati of Gujarat-based law firm Nanavati Associates.
Questions emailed to UltraTech and Everest Industries were not answered till press time. “Much like the commodity cement is, it takes years of consistent efforts on multiple fronts to build a brand out of it and create one’s position as a leader in that segment,"" said Tina Jain Mehta, co-founder of boutique branding and design firm Pineapple Consulting. “UltraTech has built a name for itself by being consistent in its effort to build a brand promise over a period of time. It is an easy, tempting lure of shortcut to success by riding over somebody else’s efforts that make people give in for getting into acts like these. No wonder UltraTech has to be vigilant as that comes as the cost of being successful."""
42,2018-06-05,UltraTech,"The resolution professional of Binani Cement submitted at the NCLT that lenders of Binani Cement have unanimously approved Ultratech's plan to take over the company

Kolkata: The resolution professional of Binani Cement Ltd. on Monday submitted the resolution plan of Ultratech Cement Ltd. at the Kolkata bench of the National Company Law Tribunal for its approval even as the tribunal agreed to hear Dalmia Bharat’s objections about Ultratech’s bid. 
Kolkata: The resolution professional of Binani Cement Ltd. on Monday submitted the resolution plan of Ultratech Cement Ltd. at the Kolkata bench of the National Company Law Tribunal for its approval even as the tribunal agreed to hear Dalmia Bharat’s objections about Ultratech’s bid.
Counsel for the resolution professional submitted at the court that lenders of Binani Cement have unanimously approved Ultratech’s plan to take over the company. It was submitted that the committee of creditors had considered and rejected Dalmia Bharat’s allegations.
According to Dalmia Bharat, Ultratech is ineligible to bid for the assets of Binani Cement under section 29A of the Insolvency and Bankruptcy Code, which bars delinquent promoters from bidding for distressed assets. Dalmia Bharat argues that Ultratech is ineligible since it has been working with Binani Industries Ltd., the parent of the delinquent cement maker.
Resolution professional Vijaykumar V. Iyer had previously cancelled a CoC meeting scheduled on 10 May because he wanted to review Dalmia Bharat’s latest objections to Ultratech’s bid. However, Ultratech’s resolution plan was approved later by the lenders.
S.K. Kapoor, counsel for Dalmia Bharat sought the tribunal to direct the resolution professional to share Ultratech’s resolution plan with them. However, the tribunal has directed the administrator to share necessary details pertaining to the lenders’ observations about Dalmia Bharat’s objections only.
Counsel appearing on behalf of Ultratech Cement Siddhartha Mitra submitted that both the National Company Law Appellate Tribunal and the Supreme Court have asked the lenders to continue with the resolution process. However their decision will be subject to the verdicts of these appellate authorities. Dalmia Bharat had moved these courts seeking a stay on the resolution process.
The Dalmia Bharat-led consortium had offered Rs6,932.46 crore to take over Binani and was declared the highest bidder. While Ultratech had bid at least Rs50 Crore lower originally, it later revised its bid to Rs7,950 crore. This led to a protracted legal battle. The Kolkata bench of the NCLT ordered the lenders to reconsider both bids and allow Dalmia Bharat to match Ultratech’s bid if it wished to. “It is made clear that if both (companies) are willing to participate in the bidding process, the committee of creditors is expected to allow both in the bidding process,"" the tribunal had said in its order of 2 May.
The NCLAT is supposed to hear Dalmia Bharat’s plea from 10 July on a daily basis. The Kolkata bench intends to conclude its hearing before that. It will hear the matter again on 18 June."
41,2018-07-18,UltraTech,"Ultratech Cement's revenue rises 30% from a year earlier to 8,476 crore in June quarter, while profit before interest, depreciation and taxes falls 2% to 1,763 crore

Mumbai: Ultratech Cement’s fiscal-first quarter profit fell 30% on higher petcoke and fuel prices.  
Mumbai: Ultratech Cement’s fiscal-first quarter profit fell 30% on higher petcoke and fuel prices. 
Net profit declined to  ₹ 631 crore in the three months ended 30 June from  ₹ 898 crore in the year earlier, the country’s largest cement maker said in a filing on Wednesday.
In a presentation to investors, the company said that logistics costs, which account for 34% of overall expenses, rose 9% from a year earlier to  ₹ 1,199 a tonne. Energy costs rose 18% due to higher prices of petroleum coke and a weakening rupee making imports more expensive. Additional royalties on limestone mines transfer, among other raw material costs, rose 8% from a year earlier. Net profit was also affected by depreciation of  ₹ 486 crore and interest costs of  ₹ 336 crore.
Revenue rose 30% from a year earlier to  ₹ 8,476 crore while profit before interest, depreciation and taxes fell 2% to  ₹ 1,763 crore. Capacity utilization of its total capacity of 92.5 million tonnes per annum (mtpa) stood at roughly 70%.
At the company’s annual general meeting held on Wednesday, K.M. Birla, chairman of Ultratech, said that the company’s acquisition of 21.2 mtpa cement capacity from Jaiprakash Associates Ltd and Jaypee Cement in June 2017 achieved an average capacity utilisation of 70% across all the regions and a cash break-even.
Birla told shareholders that Ultratech is seeking to increase its white cement capacity in the future, and is considering new limestone mining rights in this regard. 
The board recommended a dividend of  ₹ 10.5 per share. 
Shares of Ultratech fell 1.26% to  ₹ 3,852.55 on BSE on Wednesday."
