,Date,Company,Article
71,2018-03-28,UltraTech,"In other news, Binani Cement lenders seek time till 2 April to weigh UltraTech deal, while Vodafone-Idea merger is said to be in the final stage of approval

US stocks end lower; Asian markets see negative opening 
US stocks end lower; Asian markets see negative opening
US stocks closed sharply lower on Tuesday, erasing earlier gains, as a decline in the broader tech sector brought the major averages down.
Asian stocks posted declines early on Wednesday trade after US stocks fell sharply on the back of declines in technology names. 
Fortis sells hospital business to Manipal, TPG Capital
After months of intense negotiations, the board of Fortis Healthcare Ltd has announced the sale of its hospital assets to Manipal Health Enterprises Pvt. Ltd and buyout firm TPG Capital.
Binani Cement lenders seek time till 2 April to weigh UltraTech deal
Lenders to Binani Cement Ltd have asked for time till 2 April to consider UltraTech Cement Ltd’s bid for the company outside the bankruptcy process.
Monnet Ispat bankruptcy: ICICI Bank moves NCLT to include claim of $75 million
ICICI Bank Ltd has approached the National Company Law Tribunal (NCLT) to intervene in the bankruptcy proceedings of Monnet Ispat and Energy Ltd to include its claim of around $75 million (Rs486 crore).
GSK to sell Horlicks, may cut stake in India unit to fund Novartis deal
GlaxoSmithKline Plc. (GSK) is exploring a partial or full sale of its 72.5% stake in its Indian unit GSK Consumer Healthcare Ltd, besides separately selling the company’s dietary supplement brand Horlicks as it looks to fund its $13 billion buyout of Novartis’s stake in a global consumer healthcare joint venture.
Venky’s, V-Mart among 14 stocks up 10-34% despite market correction since January
In the BSE 500 index, 14 stocks have jumped 10-34% from 29 January, when the market started to fall, till date. In the Sensex, however, there are only two stocks which are in the positive terrain, in the same period. Read more
Bandhan Bank shares rise 27% on stock market debut
Shares of Bandhan Bank Ltd settled 27% higher on the bourses after its Rs4,470 crore initial public offer (IPO), the largest ever by a bank, was subscribed 14.63 times last week.
Vodafone-Idea merger in final stage of approval, says telecom secretary
The merger plan of telecom operators Vodafone India and Idea Cellular is in the “final stage of approval"", according to telecom secretary Aruna Sundararajan."
72,2018-03-28,UltraTech,"The counsel for Binani Cement lenders described UltraTech Cement's offer as 'excellent' and asked NCLT for time till 2 April to consider the offer as the matter had to be discussed among 25 lenders

Kolkata: Lenders to Binani Cement Ltd have asked for time till 2 April to consider UltraTech Cement Ltd’s bid for the company outside the bankruptcy process.  
Kolkata: Lenders to Binani Cement Ltd have asked for time till 2 April to consider UltraTech Cement Ltd’s bid for the company outside the bankruptcy process. 
On Tuesday, the Kolkata bench of the National Company Law Tribunal (NCLT) asked the lenders if they were willing to consider UltraTech’s proposal to buy a 98.43% stake in Binani Cement from its parent Binani Industries Ltd. Binani Cement is currently undergoing resolution under the insolvency and bankruptcy code (IBC).
The counsel for the lenders described the UltraTech deal as “excellent"" and asked the NCLT for time till 2 April to decide whether to consider it. The tribunal will now hear the matter on 2 April.
Though he described the proposal as “excellent"" and acknowledged that the deal could result in all creditors being repaid, the counsel for the lenders, Pratap Chatterjee, asked the Kolkata bench of the NCLT if there was any provision under IBC for an out-of-court settlement. Only the Supreme Court has the authority to terminate resolution proceedings, he said.
 Chatterjee sought time saying the matter had to be discussed among 25 lenders.
The Braj Binani group had earlier prayed for suspension of the proceedings so that it could sell its stake in Binani Cement for Rs7,266 crore and repay creditors.
It has committed to pay off Binani Cement’s dues within two weeks if allowed to sell stake to UltraTech.
Dalmia Bharat Ltd, which had earlier been declared as the highest bidder for the assets of Binani Cement, has argued that allowing an out-of-court settlement at this stage will undermine the sanctity of the insolvency resolution process under IBC. 
“If the process (of insolvency resolution) is seen as unclear or arbitrary...bona fide applicants will decline to spend time and money to submit bids,"" Dalmia Bharat has said in a petition.
After Dalmia Bharat offered Rs6,350 crore and was on 27 February declared the top bidder, UltraTech, one of the unsuccessful bidders, raised its offer substantially. Eventually, on 19 March it concluded a deal with Binani Industries for sale of 98.43% stake in the cement maker for Rs7,266 crore.
Even without rejecting UltraTech’s revised bid, Binani Cement’s committee of creditors approved a resolution plan with Dalmia Bharat as the highest bidder. Amid opposition from the Braj Binani group and UltraTech, the plan was earlier this month filed with the tribunal for its approval.
Though there is no provision under IBC to terminate the resolution process, the Supreme Court created a precedent last year. It allowed a Mumbai-based realtor and its lender to settle their dispute on mutual consent outside the framework of IBC."
70,2018-03-29,UltraTech,"After UltraTech obtained CCI approval for Binani Cement's acquisition, Dalmia Bharat said the likelihood of obtaining the regulator's approval was not a criterion in bid evaluation

Kolkata: UltraTech Cement Ltd on Wednesday said it had received clearance from the Competition Commission of India (CCI) for its proposed acquisition of the assets of Binani Cement Ltd, while claiming that its bid was declared the second-highest because the resolution professional was apprehensive about the AV Birla Group firm’s ability to secure the clearance. 
Kolkata: UltraTech Cement Ltd on Wednesday said it had received clearance from the Competition Commission of India (CCI) for its proposed acquisition of the assets of Binani Cement Ltd, while claiming that its bid was declared the second-highest because the resolution professional was apprehensive about the AV Birla Group firm’s ability to secure the clearance.
“A lot of apprehensions were raised by the resolution professional about UltraTech obtaining CCI clearance,"" the company said in its statement. “UltraTech was rated the H2 (second highest) bidder instead of H1 for this reason. The CCI clearance validates UltraTech’s contention that it was wrongly and unjustifiably rated H2 instead of H1.""
Dalmia Bharat Ltd, which was on 27 February declared the highest bidder by the committee of creditors of Binani Cement, also issued a statement saying that the evaluation criteria for bids were “fair and made known to all bidders"" in advance. “We state emphatically that the likelihood of obtaining the CCI approval was not at all a criterion in bid evaluation,"" a statement by Dalmia Bharat quoted its group chief executive officer Mahendra Singhi as saying.
Resolution professional Vijaykumar V. Iyer was not immediately available for comment. He did not reply to text messages till the time of publishing this story.
The administrator has already filed a resolution plan for the approval of the Kolkata bench of the National Company Law Tribunal (NCLT) with Dalmia Bharat as the top bidder, amid opposition from UltraTech and Binani Industries Ltd, the holding company of the cement maker. The two companies announced on 19 March that an agreement had been concluded under which Binani Industries would sell its 98.43% stake in Binani Cement to UltraTech for Rs7,266 crore.
Dalmia Bharat, which offered Rs6,350 crore for Binani Cement’s assets, has claimed in its petition that UltraTech raised its offer after being outbid. 
Its revised bid was circulated among lenders and the resolution professional by email, Dalmia Bharat has said.
Praying for termination of the resolution process without which the deal cannot be consummated, the two companies have said at the NCLT that UltraTech’s offer was better than Dalmia Bharat’s and that Binani Industries would settle the dues of all creditors within two weeks.
Dalmia Bharat has said in its petition that suspending the resolution process at this stage has larger implications, and that it would undermine the sanctity of the insolvency resolution process under the Insolvency and Bankruptcy Code.
On Tuesday, the Kolkata bench of the tribunal asked the counsel for the committee of creditors if the lenders are willing to consider UltraTech’s bid for Binani Cement. There are around 25 lenders, and they are to decide on the matter by 2 April, when the dispute is to be heard by the NCLT."
68,2018-04-02,UltraTech,"That UltraTech Cement struck a deal with Binani Cement outside the IBC framework, especially when lenders had already chosen Dalmia Bharat as the top bidder, tests the sanctity of the Insolvency and Bankruptcy Code

Fourteen petitions. That’s the number of pleas filed against the insolvency proceedings of Binani Cement Ltd, which is fast turning out to be a test for the Insolvency and Bankruptcy Code (IBC) due to multiple issues ranging from allegations of fraud to lack of transparency in the bidding process. Hearings are currently underway at the Kolkata bench of the National Company Law Tribunal (NCLT). 
Fourteen petitions. That’s the number of pleas filed against the insolvency proceedings of Binani Cement Ltd, which is fast turning out to be a test for the Insolvency and Bankruptcy Code (IBC) due to multiple issues ranging from allegations of fraud to lack of transparency in the bidding process. Hearings are currently underway at the Kolkata bench of the National Company Law Tribunal (NCLT).
1. What’s the background?
Binani Cement was a regular bankruptcy case under IBC. Bids were called for, and the committee of creditors chose a Dalmia Bharat Ltd-consortium as the winner. The resolution professional had also filed the Dalmia Bharat resolution plan with the tribunal. However, UltraTech Cement Ltd, which had also put in a bid for Binani Cement, alleged that the process for choosing the top bidder was not transparent and that the resolution professional had not followed established best practices.
2. What did UltraTech do then?
It complained to NCLT and also wrote to Binani Cement’s resolution professional, offering to increase its bid to about Rs6,900 crore from about Rs6,200 crore earlier. But when that was not accepted, the firm struck a deal with Binani Industries Ltd, the parent of Binani Cement, to buy its 98.43% stake in the cement unit, provided the insolvency case was terminated. On its part, Binani Industries approached NCLT asking that the case be terminated. At a hearing last week, Binani Industries told the tribunal that it will repay creditors within two weeks.
3. Why is this important?
UltraTech has struck this deal outside the bankruptcy framework. Striking a deal outside the framework, especially when the process is nearing completion, tests the sanctity of the code. If UltraTech wins, every unsuccessful bidder could approach the promoter and strike a deal to fund the repayment of the liabilities with the banks.
4. What does the law say?
The code itself does not have a procedure laid down for terminating the insolvency process. However, in another case last July, the Supreme Court ruled that a settlement can be considered and a case can be withdrawn after insolvency proceedings have started against a company. In that particular case, the company and its creditors had settled their dispute.
5. What next?
The committee of creditors has indicated its willingness to consider the UltraTech-Binani Industries deal since it would entail a lower sacrifice on the lenders’ part. Its counsel had sought time till Monday to consider UltraTech’s offer. If the lenders do choose to accept the offer, the Kolkata NCLT will have to rule. An adverse ruling for Dalmia may prompt the consortium to approach higher courts. If the case ends up at the Supreme Court, its ruling could set a precedent for other cases. Expect the drama to continue."
67,2018-04-02,UltraTech,"Binani Cement lenders could not consider UltraTech's proposal because the interim order asking them to do so wasn't available on NCLT's website

Kolkata: The Kolkata bench of the National Company Law Tribunal (NCLT) on Monday gave Binani Cement Ltd’s lenders one more week to decide on the revised acquisition offer made by UltraTech Cement Ltd. 
Kolkata: The Kolkata bench of the National Company Law Tribunal (NCLT) on Monday gave Binani Cement Ltd’s lenders one more week to decide on the revised acquisition offer made by UltraTech Cement Ltd.
Counsel for the committee of creditors told the NCLT that Binani Cement lenders could not consider UltraTech’s proposal because the interim order from last week asking them to do so wasn’t available on the NCLT’s website.
In its interim order passed on 27 March, the NCLT had said “in the larger interest of all stakeholders the possibility of having a harmonious settlement is to be considered"", adding that the “parties are free to consider it out of tribunal"".
“The decision by the NCLT today reaffirms the chances for an out-of-court settlement,"" said Sameer Kaji, senior adviser to Binani Cement. People close to Binani Industries Ltd said a detailed proposal will be submitted in a day or two to the CoC.
When asked whether this proposal will override Dalmia Bharat’s, Dalmia officials said the status does not change as the Insolvency and Bankruptcy Code does not allow out-of-court settlements.
Dalmia Bharat Cement CEO Mahendra Singhi is of the view that once a resolution plan is submitted to the NCLT, there is a binding contract with CoC and the party. Binani Cement had proposed to pay back all the secured and unsecured financial creditors and trade operational creditors, besides clearing all statutory dues on the condition that IBC proceedings against it have to be terminated.
UltraTech Cement has agreed to pay Binani Industries Rs7,266 crore to take 98.47% stake in Binani Cement directly from the promoters. This after Dalmia Bharat was declared the highest bidder for Binani Cement by the CoC in March beating UltraTech, which had bid marginally lower. Dalmia had agreed to invest about Rs6,700 crore in Binani Cement over a period of time. UltraTech swiftly challenged the decision of the CoC at the Kolkata NCLT, stating lack of transparency in decision-making. UltraTech also received a nod from the Competition Commission of India (CCI) to pursue the deal on 28 March.
NCLT’s Kolkata bench will hear the matter on 9 April.
PTI contributed to this story."
69,2018-04-02,UltraTech,"While Dalmia continues to repose faith in the ongoing legal process, it will challenge any move to wrest control of Binani Cement by rival UltraTech Cement

Mumbai: Dalmia Bharat Cement Ltd will approach a higher court if the Kolkata bench of National Company Law Tribunal (NCLT) decides against it in the battle for Binani Cement acquisition, a top company official said.  
Mumbai: Dalmia Bharat Cement Ltd will approach a higher court if the Kolkata bench of National Company Law Tribunal (NCLT) decides against it in the battle for Binani Cement acquisition, a top company official said. 
While Dalmia continues to repose faith in the ongoing legal process, it will challenge any move to wrest control of Binani Cement Ltd by rival UltraTech Cement Ltd, the Dalmia Bharat official said on condition of anonymity.
Dalmia Bharat was declared the highest bidder for Binani Cement by the committee of creditors (CoC) in March beating UltraTech, which bid marginally lower.
Dalmia had agreed to invest about Rs6,700 crore in Binani Cement over a period of time. UltraTech swiftly challenged the decision of the CoC at the Kolkata NCLT, stating lack of transparency in decision-making. UltraTech also received a nod from the Competition Commission of India (CCI) to pursue the deal on 28 March.  
Meanwhile, Binani Industries Ltd, Binani Cement’s parent company, signed a bilateral agreement with UltraTech to sell the company and has approached the NCLT seeking termination of insolvency proceedings against Binani Cement and has offered to settle all its outstanding loans including those of operational creditors and statutory dues.
The Binani Industries settlement offer is understood to be based a letter of comfort by UltraTech which has committed Rs7,266 crore payment for Binani Cement subject to termination of insolvency proceedings. 
Responding to a query from Mint on whether Dalmia Cement plans further legal action, Mahendra Singhi, the cement maker’s chief executive officer, said, “One has to follow proper legal processes but we hope that there won’t be any need for it. But if someone wants to further litigate and delay the whole process, it is up to them.""
The case which will be heard by NCLT on Monday is likely to set a precedent for several other bankruptcy cases where promoters are seeking out-of-court settlements. Singhi, however, said that Dalmia Bharat is not keen on an out-of-court settlement. 
“With us, no settlement can take place out of court. As a responsible corporate citizen, we are bound by a legal contract so under no case we can settle outside the court,"" he said. 
Dalmia Cement is also understood to have sent a reminder to the creditors last week about the binding contract it has signed with lenders that lays down legally enforceable conditions and the indemnities thereof. 
Last week, the Kolkata bench of the NCLT told CoC that in the larger interest of the creditors, it could consider the application by Binani Industries looking for an independent solution outside the insolvency process—its request to UltraTech Cement to take over its subsidiary Binani Cement, the Financial Express reported on 30 March."
66,2018-04-04,UltraTech,"In other news, Royal Enfield, a unit of Eicher Motors, has planned a capital expenditure of Rs800 crore for the year 2018-19

Asian stocks mixed in morning trade 
Asian stocks mixed in morning trade
Asian markets opened mixed as investors awaited China’s response to US tariffs, reports Bloomberg. Overnight US stocks closed with gains as investors looked forward to earnings season. S&P 500 at 2,614 is up 1.26%.
Indian IT companies reduce H-1B visa filings drastically
India’s largest information technology (IT) outsourcing companies, including TCS Ltd, Infosys Ltd and Wipro Ltd, have reduced their dependence on H-1B visas over the last three years, a US daily reported. Read more.
Jewellery exports decline 11% in February
Lack of institutional finance support due to Nirav Modi scam, coupled with introduction of value added taxes on gold buying by Dubai resulted in 11% year-on-year fall in gold jewellery exports from India in February, reports The Times of India.
RBI bars Axis Bank from importing bullion for FY19
The Reserve Bank of India (RBI) has dropped Axis Bank, which has been one of the largest importers of bullion, from the list of lenders allowed to ship in gold and silver for the current fiscal year, reports PTI.
UltraTech closing in on Binani deal
The out-of-court deal between UltraTech and Binani Industries seems headed towards fruition, with the latter offering to pay its lenders the entire debt if they withdraw the insolvency proceedings against it, reports The Hindu Business Line.
Jet Airways finalises deal for 75 Boeing 737 Max planes
Jet Airways has finalised an $8.7-billion deal to acquire 75 Boeing 737 MAX planes as the airline plans to launch routes and grow its market share, reports Business Standard.
Royal Enfield charts Rs800 crore capex for 2018-19
Royal Enfield, a unit of Eicher Motors Ltd, has planned a capital expenditure of Rs800 crore for the year 2018-19. The proposed capex will include construction of Phase-2 of the plant near Chennai, reports The Hindu Business Line.
Electricity spot prices may continue to rise in near term
With India bracing for a scorching summer, electricity spot prices will continue to surge in the near term, Crisil Infrastructure Advisory said.
ATC closes deal to buy telecom towers from Vodafone
American Tower Corp. (ATC) said it has completed the acquisition of Vodafone India Ltd’s stand-alone towers. Vodafone India and Idea Cellular had in November 2017 separately agreed to sell their respective stand-alone tower businesses in India."
65,2018-04-05,UltraTech,"Lenders will require Binani Industries to pay them an initial Rs750 crore and provide a bank guarantee covering the remaining bid amount

Mumbai: Binani Cement Ltd. lenders will entertain a local tycoon’s last-minute $1.1 billion bid for the insolvent Indian company, people with knowledge of the matter said. 
Mumbai: Binani Cement Ltd. lenders will entertain a local tycoon’s last-minute $1.1 billion bid for the insolvent Indian company, people with knowledge of the matter said.
The committee of creditors decided at a meeting on Wednesday it would be willing to support the proposal, which would see Binani Cement sold to billionaire Kumar Mangalam Birla’s UltraTech Cement Ltd., according to the people. The banks plan to tell Binani Cement’s parent company that they could give their backing if it first obtains relevant approvals, the people said, asking not to be identified because the information is private.
Lenders will require Binani Industries Ltd. to pay them an initial Rs750 crore ($115 million) and provide a bank guarantee covering the remaining bid amount, one of the people said. The plan would need approval from India’s National Company Law Tribunal (NCLT), according to another person.
The move would overturn a decision the lenders made last month to support an offer from a rival consortium that includes Dalmia Bharat Ltd., a domestic competitor of UltraTech, and a Bain Capital-backed fund. After creditors picked their preferred bidder, UltraTech made a higher offer directly to Binani Industries.
Binani Industries’s shares rose as much as 5.6% in Mumbai on Thursday, set for the biggest gain since 28 December, and UltraTech advanced about 2%.
UltraTech’s latest bid for Binani Cement was conditional on insolvency proceedings being terminated. The National Company Law Tribunal has adjourned a case filed by UltraTech to 9 April and asked Binani Cement lenders to form an opinion on the offer by then.
The situation is fluid, and there’s no certainty the deal will be completed as currently envisioned, the people said.
Representatives for UltraTech and Dalmia Bharat didn’t immediately respond to requests for comment. A representative for the resolution professional overseeing the Binani Cement sale, Deloitte Touche Tohmatsu India, declined to comment. Bloomberg"
