,Date,Company,Article
28,2018-12-14,UltraTech,"Lack of clarity about growth plans of ACC and Ambuja Cements had investors worried, given competitors UltraTech Cement and Shree Cement had been aggressively adding capacities

After a hiatus of more than a year, pan-India cement producers ACC Ltd and Ambuja Cements Ltd are expanding capacities. ACC will be incurring a capital expenditure of  ₹ 3,000 crore to add 5.9 million tonnes per annum (mtpa) cement capacity and 3 mtpa clinker capacity in Uttar Pradesh and Jharkhand. The company’s existing cement capacity stands at 33.41 mtpa.  
After a hiatus of more than a year, pan-India cement producers ACC Ltd and Ambuja Cements Ltd are expanding capacities. ACC will be incurring a capital expenditure of  ₹ 3,000 crore to add 5.9 million tonnes per annum (mtpa) cement capacity and 3 mtpa clinker capacity in Uttar Pradesh and Jharkhand. The company’s existing cement capacity stands at 33.41 mtpa. 
In a separate filing to stock exchanges, Ambuja Cements said that it will invest  ₹ 2,350 crore for a series of capacity additions. These include a clinker unit, a cement grinding unit, and a captive power plant and waste heat recovery system. Following these expansions, its total cement capacity will increase to 31.5 mtpa.
Lack of clarity about growth plans had investors worried, given competitors UltraTech Cement Ltd and Shree Cement Ltd had been aggressively adding capacities.
That explains the Street’s positive reaction to the expansion plans of ACC and Ambuja Cements. The two stocks have gained 4.8% and 2.6%, respectively, since the capacity expansion news became public.
Although the timeline of commissioning of capacities is not known yet, the worry of capacity overhang is behind these stocks.
“Capacity constraint was a key concern for both ACC and Ambuja. With these expansions, that overhang will be over. Going by ACC’s free cash flow at current levels, from FY2018-2020, the company could generate  ₹ 4,000-4,500 crore. So, internal accruals should be sufficient to fund the capex of  ₹ 3,000 crore. Capital is not a constraint for both these companies,"" said Binod Modi, senior research analyst at Reliance Securities Ltd. 
Since these companies had been abstaining from expanding capacities despite being flush with cash, some investors were worried that their parent firm LafargeHolcim might use these funds for further restructuring, points out another analyst.
He said because there was no plan on how their capital would be deployed, it gave peers UltraTech and Shree Cement an edge over them. On the valuation front, ACC and Ambuja Cements are trading at a discount to their peers.
However, analysts now expect these stocks to rerate and valuations to improve. 
Meanwhile, from the industry’s perspective, these expansions would weigh on the demand-supply scenario, especially in central India. Overall cement demand is yet to catch up with the spree of capacity additions that have happened recently. And that has kept the sector’s utilization levels below 70%. Secondly, higher supply in absence of adequate demand growth, would delay the sector’s price recovery, which is already subdued."
27,2018-12-14,UltraTech,"That IDBI Bank gave the loan to Binani Cement through its Dubai branch has become a sticking point, with RBI sending IDBI Bank a set of questions on the transaction

Mumbai: For capital-starved IDBI Bank Ltd, UltraTech Cement Ltd’s winning bid for insolvent Binani Cement Ltd was good news: the cement maker owed it  ₹ 1,600 crore, and UltraTech had promised to repay lenders. But now, the bank must wait. 
Mumbai: For capital-starved IDBI Bank Ltd, UltraTech Cement Ltd’s winning bid for insolvent Binani Cement Ltd was good news: the cement maker owed it  ₹ 1,600 crore, and UltraTech had promised to repay lenders. But now, the bank must wait.
According to two people familiar with the matter, the way it made the loan—through its Dubai branch to a Binani group company in Belgium—has become a sticking point, with the Reserve Bank of India (RBI) sending IDBI Bank a set of questions. Without RBI’s permission, IDBI Bank cannot receive money from UltraTech Cement or remit it to its Dubai branch.
According to the people cited above, who spoke on condition of anonymity, the loan was originally given to 3B-The Fibreglass Co., a Binani group firm in Belgium, but as the loan was guaranteed by Binani Cement, IDBI Bank was allowed to recover its loan through the insolvency process.
“We need RBI permission to remit the money to the Dubai branch where the loan was given in euros,"" the first of the two people cited above said. This person added that the central bank has sent a set of questions to IDBI Bank and the approval of the transaction is contingent upon receiving satisfactory reply from the bank.
The second person quoted above said senior IDBI Bank officials are planning to meet RBI deputy governor B.P. Kanungo to clarify its position on the transfer of funds. “This money would substantially aid our recovery efforts,"" the second person said, adding UltraTech agreed to pay the entire principal of  ₹ 1,600 crore.
In February 2012, Binani Industries Ltd, the holding company of the Binani Group, acquired 3B-The Fibreglass Co. Based in Battice, Belgium, 3B is Europe’s leading manufacturer of fibreglass for reinforcement of thermoplastics and thermoset polymer applications.
Binani Cement is part of the Braj Binani Group and is a unit of Binani Industries Ltd (BIL), which is the holding company of the group, and which has presence in business areas including cement, fibreglass, infrastructure and energy.
The loan recovery is vital for the public sector lender struggling with bad loans of  ₹ 60,875 crore, forming 32% of total loans.
IDBI Bank’s total capital adequacy ratio has, in fact, slipped below the regulatory requirement of 9% and stood at 6.22% as on 30 September 2018. The bank is also on the cusp of a major change as the government gives up its majority stake in the bank to Life Insurance Corporation of India (LIC). 
Emails sent to IDBI Bank and the RBI seeking comments remained unanswered till publishing of this story.
Last month, the Supreme Court had upheld an order of the National Company Law Appellate Tribunal (NCLAT) approving UltraTech’s revised  ₹ 7,900 crore bid to buy debt-laden Binani Cement.
On 14 November 2018, a two-member bench of NCLAT had dismissed a plea by Rajputana Properties Pvt. Ltd, owned by Dalmia Bharat Ltd, saying its offer for Binani Cement was “discriminatory"" against some financial creditors. The dispute is related to a decision by Binani Cement’s committee of creditors to consider an improved bid from UltraTech Cement after Rajputana Properties’  ₹ 6,930 crore offer was declared the highest, and filed with the Kolkata bench of the bankruptcy court for its approval.
Mint reported on 12 January 2018 that at least two lenders of Binani Cement moved the appellate bankruptcy tribunal after the resolution professional (RP) rejected their claims on corporate guarantees worth  ₹ 2,000 crore issued by the firm to some subsidiaries in the Binani group.
Banks, including IDBI Bank and SBI, had lent money to some companies in the Binani group, after Binani Cement issued corporate guarantees worth  ₹ 2,000 crore for these loans.
In July 2017, National Company Law Tribunal (NCLT) bench in Kolkata had admitted the insolvency petition against Binani Cement. State-owned lender Bank of Baroda (BoB) had referred the company to the NCLT after it failed to repay around  ₹ 100 crore, following which Vijaykumar V. Iyer of Deloitte India was appointed as the resolution professional."
26,2019-01-09,UltraTech,"Shares of large-cap cement firms such as ACC Ltd, Ambuja Cements Ltd and UltraTech Cement Ltd ended Tuesday's session largely flat

Brokerage house CLSA downgraded shares of key Indian cement makers on Tuesday because of a muted outlook on price realizations. It has trimmed earnings estimates of large-cap companies under its coverage by around 3-15% for fiscal years 2020 and 2021. 
Brokerage house CLSA downgraded shares of key Indian cement makers on Tuesday because of a muted outlook on price realizations. It has trimmed earnings estimates of large-cap companies under its coverage by around 3-15% for fiscal years 2020 and 2021.
Cement stocks responded to it with a yawn. Shares of large-cap firms such as ACC Ltd, Ambuja Cements Ltd and UltraTech Cement Ltd ended the day’s session largely flat.
Cement prices have remained weak from the past many quarters now. That the much-awaited recovery in pricing has been delayed is not new. Still, these stocks don’t seem too perturbed.
According to analysts, cement makers have been beneficiaries of the general move towards large-cap stocks in the past year. Since mid-caps were badly battered last year, domestic fund managers flocked to park their money in large-cap stocks, in the so-called chase for quality. This has kept the momentum in these stocks going, despite dismal earnings.
The market capitalization of 15 cement makers has risen by around 32% in the past three calendar years, showed an analysis by Mint. This is despite pressure on pricing and earnings. While prices have corrected from their highs a year ago, the fall isn’t commensurate with shortfall in performance, say analysts.
“Cement stocks have traded at high valuations in the past three years on expectation of a revival in demand growth and low capacity additions. The revival in demand growth did not materialise, and owing to announcements for increasing capacity addition, expectations of an upcycle have substantially waned,"" IIFL Institutional Equities said in a report last June. IIFL downgraded its outlook on the sector to negative after remaining positive/neutral for almost seven years.
MNC brokers such as CLSA and Morgan Stanley seem to be catching up with the view, although it remains to be seen when investors also take note.
ALSO READ | The real reason for 28% GST on cement
Morgan Stanley recently downgraded its view on the industry to an “in-line"" rating. “Profitability of Indian cement companies should recover from the recent lows, but the pace will be slower than expected,"" it said in a report on 19 December.
Cement companies have grappled with a variety of challenges, such as subdued demand growth due to the lull in real estate sales, the sand mining ban in some parts of the country and surging input cost pressure.
ALSO READ | The cement industry’s problem of plenty
While input cost inflation is easing and the sand mining issue is out of the way, demand growth is mainly driven by government spending on infrastructure projects. And this has been inadequate to match the ongoing spate of massive capacity additions. As a result, the capacity utilization levels of the industry remain below 70%. All of this is weighing on prices.
Speaking of valuations, large-cap cement stocks are trading at a one-year forward EV/Ebitda of around 11-22 times. EV stands for enterprise value and Ebitda is short for earnings before interest, tax, depreciation and amortization.
Now that the MNC brokers have joined the chorus of downgrades, perhaps the strength of some cement stocks may get tested."
25,2019-01-09,UltraTech,"Supreme Court on 29 November had upheld UltraTech's bid for Binani Cement and dismissed the appeal by Rajputana Properties

New Delhi: The Supreme Court has rejected a review petition by Dalmia Bharat Pvt. Ltd-owned Rajputana Properties against its ruling that upheld an order of the National Company Law Appellate Tribunal (NCLAT) approving UltraTech’s revised  ₹ 7,900 crore bid to buy debt-laden Binani Cement Ltd.  
New Delhi: The Supreme Court has rejected a review petition by Dalmia Bharat Pvt. Ltd-owned Rajputana Properties against its ruling that upheld an order of the National Company Law Appellate Tribunal (NCLAT) approving UltraTech’s revised  ₹ 7,900 crore bid to buy debt-laden Binani Cement Ltd. 
“Having carefully gone through the review petition and the order under challenge, we are satisfied that there is no error apparent on the face of the record, warranting reconsideration of the order impugned.The review petition is dismissed in terms of the signed order"", the court held on Wednesday. 
On 29 November, a two-judge bench headed by Justice Rohinton F. Nariman had upheld UltraTech’s bid and dismissed the appeal by Rajputana Properties.
Solicitor general Tushar Mehta, appearing for the committee of creditors (CoC), had told the court that UltraTech’s bid was backed by 100% of secured creditors, 100% of unsecured creditors and 100% of operational creditors.
On 14 November, a two-member bench of NCLAT had dismissed an appeal by Rajputana Properties, saying its offer for Binani Cement was “discriminatory"" against some financial creditors. A review against this decision was sought by Rajputana Properties. 
At the root of the dispute was a decision by Binani Cement’s CoC to consider an improved bid from UltraTech after Rajputana Properties’  ₹ 6,930 crore offer was declared the highest, and filed with the Kolkata bench of the bankruptcy court for its approval.
Rajputana Properties had approached the apex court in July challenging the CoC’s decision to consider UltraTech’s revised proposal, which would entirely pay off all secured and unsecured financial creditors, as well as operational creditors. The court referred the matter to NCLAT.
In its order, NCLAT had said that the resolution process under IBC should consider the interests of even those creditors, who are not part of the resolution process, such as operational creditors, while also maintaining the ability of the target company in continuing as a going concern."
24,2019-01-24,UltraTech,"Net profit declined to  ₹394 crore for the quarter ended 31 December 2018, from  ₹456 crore a year earlierRevenue from operations surged 18.9% to  ₹9,390 crore and domestic sales volume rose 15% during the quarter

Mumbai: India's UltraTech Cement Ltd posted on Thursday a 13.7% drop in net profit, dented by higher expenses. Net profit declined to  ₹394 crore ($55.30 million) for the quarter ended 31 December 2018, from  ₹456 crore a year earlier, the company said.
Meanwhile, revenue from operations surged 18.9% to  ₹9,390 crore and domestic sales volume jumped 15%.
This story has been published from a wire agency feed without modifications to the text. Only the headline has been changed"
23,2019-01-25,UltraTech,"A number of brokerage firms recently downgraded the sector due to concerns on pricingUltraTech’s stand-alone operating margin shrunk 121 basis points on a year-on-year basis to 15.8%

Elevated input costs eroded margins of UltraTech Cement Ltd even in the December quarter. The pan-India focused company’s stand-alone operating margin shrunk 121 basis points on a year-on-year basis to 15.8%. A basis point is 0.01%
Increased diesel prices pushed logistics cost higher by 4% year-on-year to  ₹1,169/tonne. A rise in the prices of petcoke during the quarter along with a depreciating rupee led to energy costs rising 16% as well. Petcoke, which is crude oil derivative, is a key input for cement producers. UltraTech meets 35% of its petcoke requirement via imports. Further, raw materials costs rose 3% owing to increased additive prices.
Not just UltraTech, but the whole sector has been battling cost pressures for some time now. What makes the situation worse is the lack of pricing power alongside.
Thankfully, crude oil prices are now easing. In a post-earnings conference call with analysts, Atul Daga, UltraTech’s chief executive, said that there is some relief on the cost front. Diesel and petcoke prices have corrected and would reduce the company’s overall costs, which would start reflecting from the March quarter onwards.
Life would have been simpler for investors in cement stocks if a timeline for price recovery would be known as well. But as Daga said, it would require a magic wand or crystal ball to know when prices will start improving.
The pricing environment for the sector remains challenging as average cement prices dropped nearly 1-2% compared to the preceding quarter, according to the company’s investor presentation. North and central India witnessed marginal improvement, whereas prices in the rest of the markets declined.
High competitive intensity in the sector has kept supply higher than demand, resulting in low utilization levels. The industry’s current capacity utilization of around 70% is not good-enough for natural pricing improvement. In the past, cement companies did well on profitability when capacity utilization was above 85%, said Daga. However, cement prices have been hiked in the northern and southern markets in January.
But sustenance is the key here. Note that a number of brokerage firms recently downgraded the sector due to concerns on pricing. It has been witnessed in the past that cement companies had to roll back prices due to subdued demand. The same is feared this time as well.
A key concern on the demand front is the forthcoming general election, said Daga. Usually, the fourth and first quarters are seasonally strong for the sector. But due to the election model code, which restricts the incumbent government from massively spending on infrastructure and related activities, Daga expects demand in the April-June quarter to be subdued. However, for the full fiscal year 2020, he foresees 7-8% cement demand growth.
Meanwhile, UltraTech’s cement volume grew 13% year-on-year to 17.9 million tonnes, in line with expectations. However, profit growth missed analysts’ estimates due to rising costs and weak realization growth.
In reaction to this, the UltraTech stock declined nearly 2% intraday on the National Stock Exchange on Thursday and ended the day’s session in the red. The stock is trading at a one-year forward EV/Ebitda multiple of 15 times, making it the second-most expensive cement stock. EV stands for enterprise value and Ebitda is short for earnings before interest, tax, depreciation and amortization.
Analysts are also concerned about the sector’s valuations, which they find uncomforting given the pressure on realizations and profits."
22,2019-02-07,UltraTech,"The key upside trigger for shares of all cement firms remains a significant revival in their pricesGiven the recent trends in cement prices across India, a sharp recovery still looks some time away

It is said that money saved is money earned. ACC Ltd appears to be living by this maxim. Despite cost headwinds, the cement producer’s key operating expenses on power, fuel and freight did not escalate in the December quarter. In fact, as the alongside chart shows, the company has achieved higher cost-efficiencies on these fronts compared to its peers. Even though the unexpected spike in raw material price did dent ACC’s operating margin growth, its efforts to limit cost increases were a positive.
But considering most cement makers are exploring options to optimize costs, getting a better handle on expenditure is not unique to the company. This also means that improvement on the cost front will not be enough for ACC to shine among peers.
The key upside trigger for shares of all cement firms remains a significant revival in their prices. Given the recent trends in cement prices across India, a sharp recovery still looks some time away.
In the case of ACC, volume growth has to catch up, too. Its domestic cement sales volumes in the December quarter grew 8.4% on a year-on-year basis to 7.5 million tonnes. While this was better-than the Street’s expectations, it still compares poorly with the double-digit growth reported by other large cement makers in the same quarter.
To be sure, ACC’s recently announced expansion plans in Madhya Pradesh, Uttar Pradesh and Jharkhand improve growth visibility as existing plants are already running at about 85% capacity utilization levels.
Since these plants are likely to be commissioned by fiscal 2022, volume growth expectations are muted until then, say analysts.
So, the company is expected to underperform the industry on volume growth in the near term. Until the expansions yield results, the ACC stock may continue to lag peers on valuations.
On an EV/Ebitda basis, shares of ACC are trading at 9.8 times, which is a steep discount compared to 17 times and 20 times of UltraTech Cement Ltd and Shree Cement Ltd, respectively. EV stands for enterprise value and Ebitda is short for earnings before interest, tax, depreciation and amortization."
21,2019-02-22,UltraTech,"Ambuja Cements' sales volume grew 4.4% y-o-y in the Dec quarter, much lower than peers' 8-10% volume growthNew capacities are likely to be commissioned only by 2020-end, capping sharp improvement in volumes until then

Some cement producers are relying on volume growth to drive earnings. Some others are sincerely hoping that recent cement price hikes will sustain, and will aid realizations. But Ambuja Cements Ltd doesn’t belong to either of these camps.
In the wake of capacity constraints, Ambuja Cements’ sales volumes grew 4.4% in the December quarter compared to the year-ago period. This is much lower than other pan-India cement makers who saw 8-10% volume growth. To be sure, the company’s plan to add capacities in Rajasthan should address this concern. But new capacities are likely to be commissioned only by the end of 2020, capping sharp improvement in volumes until then.
Secondly, Ambuja Cements has no presence in South India, where cement prices have been recently raised. So, investors shouldn’t expect much on the realizations front as well. The company has a large presence in the northern and western parts of the country, and dealer channel checks indicate that prices had declined by 1-3% sequentially during the quarter in these geographies.
Cement prices are expected to remain subdued in the run-up to the general election. Consequently, analysts have cut realization growth estimates for 2019 from 4-5% to 1-1.5%. Ambuja Cements follows a January-December fiscal year.
In short, the outlook on volumes and realizations for the company is muted. So, increased focus on cost optimization is the only feasible alternative that could aid its operating performance in the near term.
As the chart above shows, Ambuja Cements’ cost per tonne has been on the rise. Even though competitors—including UltraTech Cement Ltd and Shree Cement Ltd—have seen a rise in energy and freight costs, they are better placed compared to Ambuja Cements on volumes growth. ACC Ltd has managed costs more efficiently than the above-mentioned peers.
No wonder then that the Ambuja Cements stock is the cheapest among large-cap cement companies. The stock trades at a one-year forward EV/Ebitda of 7.8 times. EV stands for enterprise value, and Ebitda is short for earnings before interest, tax, depreciation and amortization.
Not many analysts are bullish on this sector due to the prolonged absence of price recovery. Still, if one has to choose from blue-chip cement companies, then Ambuja seems to be the least preferred."
